affiliation_id,institution_name,city,country
2c1aebfc-bb76-40cf-a1a4-49cb7ab07e8e,"Univ Chicago, Dept Pediat, Sect Hematol Oncol, 900 East 57th St, KCBD 5122, Chicago",IL,United States
712a2c83-e411-404d-b18e-703dc007e70b,"Yale Sch Med, Dept Pathol, New Haven",CT,United States
f6878ab1-3aaa-4709-b8b8-aa5d719adea9,"Xian Jiaotong Liverpool Univ, Dept Civil Engn",Suzhou,Peoples R China
0311d92f-28ad-4b1e-a7a0-531bdaaac7d3,"Iowa State Univ, Dept Civil Construct & Environm Engn, Ames",IA,United States
a502d220-f6d7-4d71-9ced-9a4a7221f386,"VSB TUO, Fac Civil Engn, L Podeste 1875-17",Ostrava 70800,Czech Republic
a1cb13b7-70f6-43e9-b738-f9c213738125,"Univ Malaya, Fac Engn, Dept Civil Engn",Kuala Lumpur 50603,Malaysia
4ca2e642-dc27-4453-938e-7077daa70146,"Univ Malaysia Sarawak, Fac Built Environm, Dept Quant Surveying",Sarawak,Malaysia
7a3150cc-05ff-40a9-abe1-a00433c37a19,"Sun Yat Sen Univ, Zhongshan Sch Med, Guangdong Prov Key Lab Brain Funct & Dis, 74 Zhongshan 2nd Rd, Guangzhou 510080",Guangdong,Peoples R China
3ab2d3ec-f931-4df9-b80d-3c4c432a0f34,"Sun Yat Sen Univ, Zhongshan Sch Med, Dept Pharmacol, 74 Zhongshan 2nd Rd, Guangzhou 510080",Guangdong,Peoples R China
45ebae39-9a33-43b1-8f12-bc88dfc84939,"Kyungpook Natl Univ, Dept Architecture",Daegu 41566,South Korea
28748f8d-c187-4290-8978-256b5fa9c81a,FarsiBIM,Tehran,Iran
e6ae7dd8-5ddc-42dd-b040-c2bb51cd1d67,"Concordia Univ, Dept Bldg Civil & Environm Engn, Montreal",PQ,Canada
e7fd1eb4-4519-4df3-81bf-cda4db9161ab,"Marquette Univ, Dept Civil Construct & Environm Engn, Milwaukee",WI,United States
6b4940c2-8b64-4051-9902-e4db79f54a1e,"Seoul Natl Univ, ICEE",Seoul 08826,South Korea
a5bea0e9-3740-4f12-aed8-c0aa07224154,"Kyung Hee Univ, Dept Architecture",Seoul 17104,South Korea
9634677d-b3a8-4fa3-8974-92beeea78f86,"Sveuciliste Zagrebu, Gradevinski Fak, Zavod Org & Ekon Gradenja",Zagreb,Croatia
21d30978-8020-4f78-8cc8-261db86526e6,Minist Graditeljstva & Prostornoga Uredenja,Zagreb,Croatia
57e03e7b-4ab7-4256-8f47-37c1806bd7b9,"Southeast Univ, Dept Construct & Real Estate",Nanjing,Peoples R China
aede1296-e4e7-49e4-90ab-80c297771472,"Nanjing Univ, Sch Management & Engn",Nanjing,Peoples R China
f6caf2f4-512c-43b1-8124-997ee8412da6,"Univ Calgary, Dept Civil Engn, Calgary",AB,Canada
4fd047bc-f858-4ce8-aba5-3442f9392557,"Univ Moratuwa, Dept Bldg Econ",Moratuwa 10400,Sri Lanka
3fa098b8-7d23-4306-bc8f-3e3bf58c36d8,"Univ Technol Baghdad, Civil Engn Dept",Baghdad,Iraq
2cf49557-1c6b-4b60-9365-689189df5a70,"Univ Technol Baghdad, Engn & Technol Journal",Baghdad,Iraq
99fd051d-3b95-4893-b8d7-77b3ee38b0cb,"Univ Technol Baghdad, Dept Reconstruct & Projects",Baghdad,Iraq
13b4b439-6516-4588-b372-0404ef7d7bdb,"Tech Univ Dortmund, Lehrstuhl Immobilienwirtschaft & Bauorg, August Schmidt Str 8",D-44227 Dortmund,Germany
5e085a57-c44c-473d-8a94-604706492ff7,"Univ Innsbruck, Arbeitsbereich Baubetrieb Bauwirtschaft & Baumana, Technikerstr 13",A-6020 Innsbruck,Austria
86fa78f0-166c-460d-8abb-2b28b86b2b1c,"Polytech Univ Catalunya UPC, ETSAB, Virtual Innovat Modelling Architecture & City VIM, Diagonal 649-1",Barcelona 08028,Spain
5c57e40b-48ec-49d1-a3b9-d45f9309ad19,"Univ Teknol MARA, Fac Architecture Planning & Surveying",Shah Alam,Malaysia
28532f9f-7373-4471-bc7e-dbe27ea29e0f,"Publ Works Dept PWD, Bldg Work 2 Branch",Kuala Lumpur,Malaysia
35f8da27-5dfc-4af5-8a40-7e17a4b8ff50,"Eindhoven Univ Technol, Dept Built Environm",Eindhoven,Netherlands
adc2f000-6406-4822-ad45-c98bcd3d5e71,"Univ Lorraine, CNRS, CRAN",Epinal,France
862f77e3-4b80-43d4-8efb-099feb83825d,"Teesside Univ, Sch Comp Engn & Digital Technol",Middlesbrough,England
c7111efa-e657-490f-bdf0-643680cacb6b,"Birmingham City Univ, Fac Comp Engn & Built Environm",Birmingham,England
61aedd82-64f0-4784-b978-4eaad8194dde,"Brunel Univ London, Dept Civil & Environm Engn",Uxbridge UB8 3PH,England
4bb9ae22-53f2-4b27-9e4a-7bed5bdcf0f8,"Dubai Int Acad City, Univ Birmingham, Dept Civil Engn, POB 341799",Dubai,United Arab Emirates
20798dc9-3774-48ee-a551-307c0f94d50b,"Appl Sci Private Univ, Appl Sci Res Ctr",Amman 11937,Jordan
15cc324b-3a95-4490-a423-0ee494f00e74,"Vellore Inst Technol, Sch Civil Engn",Chennai 603103,India
16ac9d58-a6e9-4c8c-902a-1f0627394588,"Khulna Univ Engn & Technol, Dept Bldg Engn & Construct Management, Khulna, Bangladesh; Islamic Univ Gaza, Fac Engn, Civil Engn Dept",Gaza Strip,Palestine
18ed44fd-b78c-41a4-8121-54cd810e5a77,"Univ Liverpool, Sch Architecture, 19-23 Abercromby Sq",Liverpool L69 7ZN,England
36d73aaf-c82b-4e04-9f50-80da44f1990d,"Prince Sattam Bin Abdulaziz Univ, Coll Pharm, Dept Pharmaceut",Alkharj 11942,Saudi Arabia
b3d8729d-9b1a-4916-99b6-5c7309794825,"Suez Canal Univ, Fac Pharm, Dept Pharmaceut & Ind Pharm, Ind Pharm",Ismailia 41522,Egypt
1fd34d15-0dae-42ed-ae4e-2db374e9fb02,"Princess Nourah Bint AbdulRahman Univ, Coll Pharm, Dept Pharmaceut Sci, POB 84428",Riyadh 11671,Saudi Arabia
0f54e7d1-2faa-46b2-b98e-ae4fa565659e,"Zagazig Univ, Fac Pharm, Dept Pharmaceut & Ind Pharm",Zagazig 44519,Egypt
1c8392c6-6691-40e8-a11c-b19a68ef0351,"Univ Hail, Coll Pharm, Dept Pharmaceut",Hail 81442,Saudi Arabia
4e0e642a-b690-40c7-8985-b946e81f1421,"Oxford Brookes Univ, Sch Built Environm, Oxford OX3 0BP",Oxon,England
93a805a3-f7e7-40a5-8001-888f4a8e947a,"Univ South Australia, UniSA STEM, Sustainable Infrastructure & Resource Management S",Adelaide 5001,Australia
5b39ff65-4798-40c9-951d-d70eb7657640,"Univ Johannesburg, Fac Engn & Built Environm, POB 524",Johannesburg,South Africa
456ba630-a41d-47f5-beba-a2a9aafceed0,"British Univ Egypt BUE, Civil Engn Dept",Cairo 4240100,Egypt
736d4db0-13f5-46bc-900b-8f1c2ce76cf3,"Univ Malaya, Fac Built Environm, Dept Bldg Surveying",Kuala Lumpur,Malaysia
7318105c-6c3e-452c-b6b5-6dc78044db3c,"Univ Malaya, Fac Built Environm, Ctr Bldg Construct & Trop Architecture BuCTA, Dept Bldg Surveying",Kuala Lumpur,Malaysia
5f073359-f5d2-4b21-89a5-428c4b462ce9,"Univ Malaysia Pahang, Fac Civil Engn Technol",Kuantan,Malaysia
d5d9f8b4-200e-4e52-b02e-7955597ae195,"Daffodil Int Univ, Gen Educ Dev",Dhaka,Bangladesh
8bf3a798-c018-4cf4-b9fb-da4db5dd90d0,"UCL, Bartlett Sch Sustainable Construct",London,England
3c74699b-3b38-401b-8ecb-8290fa2fce12,"Univ Adelaide, Sch Architecture & Built Environm",Adelaide,Australia
a6b4e2fc-8d67-4479-827d-dc30142f27e5,"Auckland Univ Technol, Sch Future Environm, Dept Built Environm Engn",Auckland,New Zealand
b080cfa0-b298-43e0-8894-b49636cf8663,"Transilvania Univ Brasov, Fac Civil Engn, Turnului St 5",Brasov 500152,Romania
5ee69a10-8f87-4f50-910b-450607fcdad5,"Cukurova Univ Adana, Civil Engn Dept",Adana,Turkey
cbe5fd38-2d25-42d0-8e2c-316538de3a64,"Univ Engn & Technol, Dept Civil Engn",Rawalpindi 47050,Pakistan
48b17c0d-32e0-4269-b7aa-512f6145aff0,"Taif Univ, Coll Engn, Dept Civil Engn, POB 11099",Taif 21944,Saudi Arabia
6a953c53-7541-4242-b44d-bb8f0a816741,"Josip Juraj Strossmayer Univ Osijek, Dept Civil Engn, VladimiraPreloga 3",Osijek 310009,Croatia
e785d5e5-7c51-4d20-b022-42e806036b94,SIASUN Robot & Automat CO Ltd,Shenyang 110169,Peoples R China
33d2514b-c9cd-41b7-b9f7-c93e023b3d1d,"Liaoning Tech Univ, Sch Civil Engn",Fuxin 123000,Peoples R China
c75c4e1f-86b9-4186-9061-7c466f2f2867,"Tsinghua Univ, Tsinghua Shenzhen Int Grad Sch",Shenzhen 518055,Peoples R China
66c842a7-b9e8-4906-972c-1ead4b7191b0,"Shenyang City Univ, Sch Intelligent Engn",Shenyang 110112,Peoples R China
e301a2ea-b2b8-4a6d-ad63-b3b3aadc71e3,"Auckland Univ Technol, Sch Future Environm, Dept Built Environm Engn",Auckland 1010,New Zealand
c356423b-2269-419e-9e5c-79917c395f82,"Univ Alberta, Dept Civil & Environm Engn, Edmonton",AB T6G 1H9,Canada
a1879bae-dbac-41ca-af44-13e570043e8a,"Western Michigan Univ, Dept Civil & Construct Engn, Kalamazoo",MI,United States
9ef76530-1c72-423f-80c6-d0e42fce2f59,"Chengdu Univ Technol, Coll Environm & Civil Engn",Chengdu,Peoples R China
62e84e5b-4fd2-43fa-9f7b-2ccc7abadfe0,"Chengdu Univ Technol, Coll Management Sci",Chengdu,Peoples R China
f97881e2-ed2b-42be-b260-a0123ede58ba,"Sichuan Coll Architectural Technol, Dept Engn Management",Deyang,Peoples R China
d09b3a29-4ce8-46eb-a9ff-5e3e8cee8085,"Deakin Univ, Sch Architecture & Built Environm",Melbourne,Australia
d24516b8-296f-4581-804e-31e21f1c7bfe,"Sunway Univ, Dept Comp & Informat Syst",Subang Jaya,Malaysia
8ae3651f-8a03-4ec0-b740-ce84f69024c2,"Sunway Univ, Sch Amer Educ",Subang Jaya,Malaysia
9fc88f9b-c12c-4602-8fb5-56193087e835,"Sunway Univ, Dept Engn",Subang Jaya,Malaysia
554b7b97-32e2-4659-b315-bdf009b99946,Sunway Univ,Subang Jaya,Malaysia
dfb32fa0-3e25-47e5-b6aa-da53b8d95846,"Malawi Univ Business & Appl Sci, Sch Engn, Private Bag 303, Chichiri",Blantyre,Malawi
f4edb0d4-eb14-4280-b8db-23f226f07678,"Malawi Univ Business & Appl Sci, Sch Built Environm",Blantyre,Malawi
c18b28da-01cc-401b-9676-3dfdc2ef2d6b,"Univ Hong Kong, Dept Civil Engn",Hong Kong,Peoples R China
41ddf817-03d2-4f3b-9606-1aff5f69032d,"Univ Hong Kong, Dept Civil Engn, Haking Wong Bldg",Hong Kong,Peoples R China
4daa0639-09f0-4340-ab97-3049b0096575,"Coventry Univ, Ctr Built & Nat Environm, Priory St, Coventry CV1 5FB",W Midlands,England
376e8613-79e9-45b3-8e8a-11274b695342,"Univ Bath Claverton, Dept Architecture & Civil Engn, Bath BA2 2AY",Avon,England
9959b95c-0c39-4543-be08-1cca59964b7a,"Univ South Australia, Sustainable Infrastruct & Resource Management SIR, UniSA Stem, Adelaide",SA,Australia
b77f6a21-6d8e-4078-a3b3-f3e0ad993f0c,"Hefei Univ Technol, Sch Civil Engn, 193 Tunxi Rd, Hefei 230009",Anhui,Peoples R China
a35397ea-e2d6-4541-9078-0642fbf1f2e4,"Western Sydney Univ, Sch Built Environm, Locked Bag 1797, Penrith",NSW 2750,Australia
7c0ec875-bf13-4e26-9646-e738dc3e93c1,"Queensland Univ Technol QUT, Sch Built Environm, Brisbane",Qld 4001,Australia
76374ee6-66a9-4014-bdcf-cf8f6d49ea02,"Univ Teknol Mara UiTM, Fac Architecture Planning & Surveying, SRI Iskandar Campus, Seri Iskandar",Perak,Malaysia
9e0a8753-157f-4127-b6cd-bf2644067128,"Univ Toronto, Dept Civil & Mineral Engn, Toronto",ON,Canada
83796857-bde3-4833-a18a-5c5e8e18e115,NASKAAI SL,Barcelona,Spain
3fa5e6e4-9b8f-4ca4-b4b4-e173c8584624,"Univ Muhammadiyah Aceh, Dept Civil Engn",Banda Aceh 23245,Indonesia
2232cc70-c2f4-4a84-aeb4-0994add8454b,"Shenzhen Univ, Key Lab Urban Land Resources Monitoring & Simulat, Minist Nat Resources",Shenzhen 518060,Peoples R China
e57730bd-45ce-4dc7-b6e6-a5ef3d50e4a1,"Cent South Univ, Sch Geosci & Info Phys, Key Lab Metallogen Predict Nonferrous Met & Geol E, Minist Educ",Changsha 410083,Peoples R China
64381f5c-9993-4665-bed9-011f5d70ede5,"Guangdong Acad Social Sci, Inst Environm & Dev",Guangzhou 510635,Peoples R China
451f9345-e795-48ee-bd81-511931dc0dfb,SFMAP Technol Shenzhen Ltd,Shenzhen 518000,Peoples R China
3dc7e5c2-227a-46f1-b239-dfbc707f2137,"Hashemite Univ, Fac Engn, Dept Allied Engn Sci, POB 330127",Zarqa 13133,Jordan
28ad83de-7939-4179-824a-4544dadecd17,"Univ Jordan, Dept Geol",Amman 11942,Jordan
1f88928a-f219-48aa-a4e2-e734058b8880,"Maintenance Technol Ctr Jiangxi Prov Commun Inves, Rd Network Operat & Management Co, Nanchang 330000",Jiangxi,Peoples R China
f620acea-235f-4964-adf6-792f67a187a8,"Chongqing Univ, Inst Smart City Chongqing Univ Liyang",Liyang 213300,Peoples R China
6d982121-bbea-42f9-a6da-47702c68102f,"Univ Waterloo, Dept Civil & Environm Engn, Waterloo",ON,Canada
988c677e-f938-4574-a38a-5542a9bd5ef7,"Slovak Univ Technol Bratislava, Fac Civil Engn, Dept Bldg Technol",Bratislava 81005,Slovakia
44d38b15-ca55-489d-af5f-47fe41569bb5,"Slovak Univ Technol Bratislava, Fac Civil Engn, Dept Surveying",Bratislava 81005,Slovakia
09792014-f09e-4c02-9587-f58d51f5c5a4,"Northern Border Univ, Dept Civil Engn, Coll Engn",AraAr,Saudi Arabia
ee85b428-0511-4d49-8f37-fd1d08acaa93,"Univ Malaysia Pahang Al Sultan Abdullah, Fac Civil Engn Technol",Kuantan 26300,Malaysia
cb5aa572-af0f-4aee-8b54-cc9834230386,"Daffodil Int Univ, Fac Grad Studies",Dhaka 1341,Bangladesh
085e20d7-88b9-40d8-a59a-bd8e77b51e32,"Univ Mosul, Coll Engn",Mosul,Iraq
00d3caf2-2360-431f-87a7-89ce626bf334,"Adnan Menderes Univ, Fac Engn, Dept Civil Engn",TR-09100 Aydin,Turkey
dcfd3411-eeeb-4f08-8985-8aeb4deb41da,"Mokpo Natl Univ, Biomed & Healthcare Res Inst, Dept Biomed Hlth & Life Convergence Sci, BK21 Four",Jeonnam,South Korea
4dbedf22-6cfd-4483-b874-c525eff7114f,"Mokpo Natl Univ, Coll Pharm",Jeonnam,South Korea
a40263cd-9055-4e28-a594-ffd7c456d2ab,"Mokpo Natl Univ, Nat Med Res Inst",Jeonnam,South Korea
3c6a0d2d-2914-4468-81b7-25f886e492ae,BioBelief Co Ltd,Seoul,South Korea
75833c24-16f0-487b-9839-bf0c1cb7b57f,"Chung Ang Univ, Dept Dermatol, Coll Med",Seoul 06973,South Korea
a8176f90-6b5c-4592-a078-a06dce6a1f21,"Curtin Univ, Sch Design & Built Environm",Perth,Australia
d6df8114-21cd-4e07-be81-4e17ba90b61d,"Curtin Univ, Sustainable Built Environm Natl Res Ctr, Perth",WA,Australia
6aebaa5d-5f77-43b6-8bac-e2f4217209bc,"Newcastle Univ, Sch Engn",Newcastle,England
dc4f0059-e358-49c4-af93-575d3fa415eb,"Univ Technol Baghdad, Dept Architectural Engn",Baghdad,Iraq
3e14e340-3b59-4dd0-9b55-05fe727a84e3,"Durban Univ Technol, Dept Construct Management & Quant Surveying, Steve Biko Campus",Durban,South Africa
a5927a17-a8b7-4264-b68a-4d96d4358367,"Coventry Univ, Fac Engn Environm & Comp, Coventry",W Midlands,England
b2faaaf8-ff78-4ab2-b010-04fe85e22a2c,Tianjin Univ Technol,Tianjin,Peoples R China
cb1a788d-cff0-4afa-9940-78f77bd14130,"Univ Minnesota, Duluth",MN,United States
d61f3ee8-70b8-45c8-a532-1c0122ae48f5,"Shenzhen Univ, Coll Civil & Transportat Engn, Sino Australia Joint Res Ctr BIM & Smart Construc",Shenzhen 518060,Peoples R China
afe6df17-568f-4d91-bd74-2163c99f8a83,"Shenzhen Univ, Coll Civil & Transportat Engn, Dept Construct Management & Real Estate",Shenzhen 518060,Peoples R China
b64f13db-70c2-4d02-aad9-90037bad57e0,"Shenzhen Univ, Key Lab Resilient Infrastruct Coastal Cities, Minist Educ",Shenzhen 518060,Peoples R China
d914ea42-47d7-48e6-8e63-607dc85d189d,"Univ West England, Fac Environm & Technol",Bristol BS16 1QY,England
4be2f0ad-587e-470f-9cab-287bb4599253,"Univ Technol Malaysia, Fac Engn",Johor Baharu,Malaysia
ec6d9108-9e33-4de4-9827-7c19824c428e,"Univ Technol Malaysia, Fac Built Environm & Surveying",Johor Baharu,Malaysia
6887a4c3-599c-4fe1-8475-d5817ec2b80f,FPT Univ,Hanoi,Vietnam
8be9808f-31b3-48e8-8b53-dfd500b925c7,"Univ Johannesburg, Fac Engn & Built Environm",ZA-2006 Johannesburg,South Africa
440465dc-36ae-412b-8ba3-0a240293ed9a,"Univ Manchester, Dept Mech Aerosp & Civil Engn MACE, Manchester M13 9PL",Lancs,England
fafeaf97-5ff5-4aed-93ee-cca6b71db024,"Istanbul Tech Univ, Dept Civil Engn",Istanbul,Turkey
522cc3d8-83fc-4532-8887-bf6a962b6e78,"Newcastle Univ, Dept Engn, Newcastle Upon Tyne",Tyne & Wear,England
44b138b3-a268-4473-bfb8-4a6bb4f896db,"Makerere Univ, Dept Construct Econ & Management",Kampala,Uganda
692235ca-f90f-4c98-b15d-82739e05c3fe,Pearl Engn Co Ltd,Kampala,Uganda
218d6161-3059-4e45-ae89-e9a840923bd3,"Univ Leeds, Sch Civil Engn, Leeds",W Yorkshire,England
cf3ebd96-28a1-48e6-b47f-665e20a6bb5a,"Islamic Azad Univ, Fac Civil & Earth Resources Engn, Dept Civil Engn, Cent Tehran Branch",Tehran 1469669191,Iran
b01d0a6c-cd1c-4ab6-ad40-3c71a5cf0c87,"Shahid Beheshti Univ, Dept Law",Tehran 1983969411,Iran
b658dda2-8e33-46ce-98a3-4b204a6a1b73,"Guangzhou Univ, Sch Management",Guangzhou,Peoples R China
e2e036fc-59b7-49f7-ba1d-a593ad9459e5,"Harbin Inst Technol, Sch Management",Harbin,Peoples R China
e5fc106b-e944-473b-842b-29d50eae001c,China Overseas Land & Investment Ltd,Shenzhen,Peoples R China
0c10570a-efda-4a9b-8f93-a209fc75b207,"Shenzhen Univ, Shenzhen Key Lab Green Efficient & Intelligent Co",Shenzhen,Peoples R China
dea3d81d-52f0-46e1-bbd5-13e2c0b33cb9,"Natl Taiwan Univ, Dept Civil Engn, 1, Sec 4, Roosevelt Rd",Taipei 10617,Taiwan
27475906-794c-462f-b5f5-25e0829b3592,"Natl Univ Civil Engn, Fac Construct Econ & Management, 55 Giai Phong Rd",Hanoi,Vietnam
0e7494e4-d847-49b0-8257-cacd38ad3188,"Appl Sci Univ ASU, Coll Engn",Eker,Bahrain
9f299c36-1483-42c7-8819-21b19c65f7c8,"October Univ Modern Sci & Arts MSA, Fac Engn, Architectural Syst Engn ASE Dept",Cairo,Egypt
83813a90-1cde-4b0b-9038-47017a087248,"October Univ Modern Sci & Arts MSA, Fac Engn",Cairo,Egypt
3df97b51-cbfc-438c-a7da-5cd1a08851ff,"Univ Indonesia, Dept Elect Engn",Depok 16424,Indonesia
7f13e8d7-c84f-4e59-bcce-ddd2a09eac04,"Hong Kong Polytech Univ, Fac Construct & Environm, Dept Bldg & Real Estate",Hong Kong,Peoples R China
9b5b7fe7-60ff-49ae-864a-7941582ac47b,"Univ Canterbury, Dept Civil & Nat Resources Engn",Christchurch,New Zealand
0b8f22cf-e682-49da-b4fb-1a201dd2704e,"Unitec Inst Technol, Sch Bldg Construct",Auckland,New Zealand
187f41de-f557-44db-8830-0774c52f6f0b,"Tampere Univ, Fac Built Environm",Tampere,Finland
182ef006-d660-4a12-b3d5-e9f8bf5b2022,"Victoria Univ Wellington, Fac Architecture & Design Innovat",Wellington,New Zealand
0bc0c59c-f469-4462-9252-2aa6dde4231a,"Univ Sains Malaysia, Sch Housing Bldg & Planning",George Town,Malaysia
1864debf-b6f8-4b81-9942-e885c986fa95,"Univ Malaysia Pahang, Fac Civil Engn Technol",Gambang,Malaysia
f0c483b6-a0c6-4681-8bd0-dbec32589118,"Daffodil Int Univ, Gen Educ Dept",Dhaka,Bangladesh
f5cba572-83e8-412e-887d-72d384c3364e,"Univ New South Wales, Sch Built Environm",Sydney,Australia
59b20814-840a-4499-8259-3e6cae97c696,"Massey Univ, Sch Built Environm",Auckland,New Zealand
3563a284-006d-458a-a9b5-87f5abb5002b,"Univ Melbourne, Ctr Spatial Data Infrastruct & Land Adm, Dept Infrastruct Engn, Parkville",Vic,Australia
563658e1-5ed7-4c07-9660-d0345c82c780,"Dept Environm Land Water & Planning DELWP, Land Use Victoria, Melbourne",Vic,Australia
96bdee1d-c47c-4840-8d8f-970d7cee8c32,NovaCITYNETS Pte Ltd,Singapore,Singapore
0b9490cd-8177-4d0b-b778-400e02597488,"Ozyegin Univ, Fac Engn",TR-34794 Cekmekoy Istanbul,Turkey
f7e14935-c988-4bb3-a2a3-4cf14905e8f1,"Isik Univ, Fac Engn",TR-34980 Sile Istanbul,Turkey
9ccceec0-d3fb-4d9e-98da-7f3c9e31188a,"Dalian Univ Technol, State Key Lab Fine Chem, Sch Chem Engn",Dalian 116024,Peoples R China
f2426934-a665-4707-b855-a85821c9e543,"Tsinghua Univ, Sch Software",Beijing,Peoples R China
1584adf3-ff6a-415b-b699-22679ea1c184,"Natl Univ Singapore, Dept Bldg",Singapore,Singapore
d08f6a57-386f-46b0-a6e8-38977e6774f1,"Univ Katolik Parahyangan, Civil Engn Dept",Bandung,Indonesia
0fcef01f-c891-4d30-93bf-1420f1ba4716,"Beijing Univ Civil Engn & Architecture, Beijing Key Lab Intelligent Proc Bldg Big Data",Beijing 1000044,Peoples R China
8c410dc8-4a06-4b71-a621-f1226d499857,"Beijing Univ Civil Engn & Architecture, Sch Humanity & Law",Beijing 1000044,Peoples R China
039e6fa9-4259-4a53-a41e-80cab8f4ff02,"Hunan Vocat Inst Safety Technol, Changsha 410000",Hunan,Peoples R China
fa84aa6d-91cf-484f-a274-c70f1b61231f,"Univ Texas Austin, Dept Civil Environm & Architectural Engn, Austin",TX,United States
41fa34b4-2b5d-4f73-b2d8-2ebbbcbc98ee,"Zhejiang Sci Tech Univ, Dept Chem, Hangzhou 310018",Zhejiang,Peoples R China
99ff709d-9945-45d4-87b4-2922a727f8df,"Chung Ang Univ, Dept Comp Engn, 84 Heukseok Ro",Seoul 06974,South Korea
f26bf739-7c90-4e28-8a8a-5167a8643ada,"Univ South Australia, UniSA STEM, Adelaide",SA 5000,Australia
47c159ba-3112-41b3-b2fd-0d489aaec3b7,"Duy Tan Univ, Inst Res & Dev",Danang 550000,Vietnam
9699a211-7d38-461a-8a03-2643311a8296,"Duy Tan Univ, Fac Civil Engn",Danang 550000,Vietnam
28dd9331-739f-4335-a135-b494557943c8,"Natl Cent Univ, Dept Civil Engn, Informat Technol Disaster Prevent Program",Taoyuan,Taiwan
f00f61f7-cc16-4475-956d-5f224d9c58ad,"Powerchip Corp, Hsinchu Sci Pk",Hsinchu,Taiwan
62e2be34-e646-46b1-808a-8b02eee1a7db,"Beijing Univ Civil Engn & Architecture, Beijing Key Lab Intelligent Proc Bldg Big Data",Beijing,Peoples R China
03d748ac-d1fe-452c-be59-821b8e6cc092,CNPC Managers Training Inst,Beijing,Peoples R China
b7dfdac2-0402-474f-936f-fa83c33ecfda,"Beijing Univ Civil Engn & Architecture, Beijing Engn Res Ctr Monitoring Construct Safety",Beijing,Peoples R China
f4cfa635-b68f-43c2-90da-66851d3f8a3d,"Ningxia Univ, Sch Informat Engn",Ningxia,Peoples R China
dfcb8895-6903-418c-9500-1f5100b044bd,"Beijing Univ Civil Engn & Architecture, Inst Mapping & Urban Spatial Informat",Beijing,Peoples R China
a1847e5e-0dbd-4118-8338-be473f31b4fc,Beijing Capital Highway Dev Grp Co Ltd,Beijing,Peoples R China
7a9913fb-399f-4c09-a6de-7629df97e215,"Tsinghua Univ, Sch Civil Engn, Dept Construct Management",Beijing 100084,Peoples R China
80c874b2-174f-4f72-9350-c57aa79c585e,"Curtin Univ, Sch Built Environm, Dept Construct Management, Perth",WA,Australia
c7b3fd1e-c67b-42b0-bf8e-33c50566aaee,"Beijing Univ Civil Engn & Architecture, Beijing Engn Res Ctr Monitoring Construct Safety",Beijing 100044,Peoples R China
81086793-8196-48bc-b63b-eb11eb6cb369,CATS,Beijing 100029,Peoples R China
56a97ff6-476d-4b65-99e4-4761aafd03ec,Beijing Waterworks Grp Co Ltd,Beijing 100038,Peoples R China
76673ce4-29ca-43d5-8940-36dc7a28c2f5,"British Univ Dubai, Fac Business & Law",Dubai,United Arab Emirates
b60318b8-cf1d-4e86-8b62-163320c5c9a5,"Univ Liverpool, Fac Humanities & Social Sci, Dept Architecture, Liverpool",Merseyside,England
9787ed72-d523-4f5e-be4b-d4a134183e24,"Res Ctr Architecture & Engn, MAP CRAI Mixed Res Unit Models & Simulat Architec, UMR 3495",F-54000 Nancy,France
fdb09a0f-55f6-4c75-9944-1a86a8a745ba,"CNRS, Natl Ctr Sci Res",F-75794 Paris,France
16118ec2-8319-425e-bef0-6f7db565e61a,LIST,L-4362 Esch Sur Alzette,Luxembourg
03e371a9-24c7-4cf0-ba68-7410e0ad8624,Univ Lorraine,F-54000 Nancy,France
2bd6f736-e60d-4e35-8a7e-cbb51a783ac0,"Univ Hong Kong, Fac Architecture, Dept Real Estate & Construct",Hong Kong,Peoples R China
e9d3fad6-0735-4476-85d8-86ab691fc2be,"Univ Copenhagen, Dept Comp Sci",DK-2100 Copenhagen,Denmark
a15bb7bb-8333-4ab4-b9ce-752252df396f,"Univ Amsterdam, Inst Phys",NL-1090 GE Amsterdam,Netherlands
9eb7b42f-e4c9-4c2a-8394-42b9efb5bf48,"Univ Amsterdam, Korteweg de Vries Inst Math",NL-1090 GE Amsterdam,Netherlands
767c1dc9-b0e1-4235-95ff-dca93b6570d9,"Univ Amsterdam, Inst Phys",NL-1090 GL Amsterdam,Netherlands
ed7e86ba-131d-4da8-b9a3-e11bba86488f,"CALTECH, Walter Burke Inst Theoret Phys, Pasadena",CA,United States
1fdd45ba-f1b6-462f-bbee-75741bae87db,"Int Sch Adv Studies SISSA, Via Bonomea 265",I-34136 Trieste,Italy
cfd4161f-6dbd-449d-8e4c-b869905117b8,"McGill Univ, Dept Math & Stat, Montreal",PQ,Canada
604d9c40-652f-47aa-8f04-a6d19c8b541f,"McGill Univ, Dept Phys, Montreal",PQ,Canada
da4d3d9c-b74b-477f-be2a-6b8b239bf9f0,"Weizmann Inst Sci, Dept Particle Phys & Astrophys",IL-7610001 Rehovot,Israel
ede3311e-6f94-4d8d-ad10-83014a310f87,"Helwan Univ, Fac Engn Mataria, PMSC Program",Cairo 11795,Egypt
db5511b9-fe22-4902-a4bc-96fd9b22c67d,"King Saud Univ, Coll Architecture & Planning, Dept Architecture & Bldg Sci",Riyadh 11362,Saudi Arabia
23f84b3c-570a-453d-a0c6-b7f55129e6c7,"Univ Reading, Sch Built Environm, Whiteknights Campus",Reading RG6 6DF,England
73e9e5e9-3809-4ff8-a0e1-37b357632d7c,"Istanbul Tech Univ, Dept Architecture",Istanbul,Turkey
6e7edaf8-42ea-4d01-bb53-1705b9cebddc,"Univ Portsmouth, Portsmouth",Hants,England
fa273d2e-b79e-4b1a-b43c-8985b62d278b,Al Ahliyya Amman Univ Jordan,Amman,Jordan
8794bd40-24fb-4e22-8905-6f2de6cdc12f,"King Saud Univ Riyadh, Coll Architecture & Planning",Riyadh 57448,Saudi Arabia
c84ecfb7-fa1e-41ce-bcec-176dbee96f3e,"Arab Acad Sci Technol & Maritime Transport AASTMT, Coll Engn & Technol",Cairo 12577,Egypt
45dba426-4fba-4282-91ad-4dd857b9285f,"Mansoura Univ, Struct Engn Dept",Mansoura 35516,Egypt
8448e0c4-7d0f-4521-8420-005a6d247eea,"Arab Acad Sci Technol & Maritime Transport AASTMT, Dept Construct & Bldg",Cairo 12577,Egypt
5c84bb02-68b7-4c8a-98c5-15cca39d2c42,"Badr Univ Cairo BUC, Civil Engn Dept",Badr City 11829,Egypt
6042bd3d-9ab8-4f95-b2ba-859241a2e4c0,"Shenzhen Univ, Minist Educ, Key Lab Resilient Infrastruct Coastal Cities",Shenzhen,Peoples R China
15537afe-5438-4c77-929c-ad1e88107adb,"Univ Hong Kong, Dept Urban Planning & Design",Hong Kong,Peoples R China
072ffd41-1acc-4d2c-985f-e27ea29ef909,"Southern Univ Sci & Technol, Sch Syst Design & Intelligent Mfg",Shenzhen 518051,Peoples R China
c3943e7d-819f-4d8a-af33-05e12b6061ec,"Shijiazhuang Changhong Bldg Decorat & Engn Co Ltd, Shenzhen Operat Ctr",Shenzhen 518055,Peoples R China
4462f254-2d87-436b-a680-13a4a26f397d,"Curtin Univ, Sch Design & Built Environm, Dept Construct Management, Bentley",WA,Australia
86eebce0-6bc3-4916-bb5c-9080f76c44ec,"Georgia Inst Technol, Coll Design, Sch Bldg Construct, Atlanta",GA,United States
009dc717-370d-4e99-977a-0b00de14f085,"Kennesaw State Univ, Dept Construct Management, Marietta",GA,United States
382338ff-3e90-46f6-8e8c-09072c2b83d7,Yuejin Technol Co Ltd,New Taipei,Taiwan
1159928a-fa6e-448c-878a-1b42f8315a03,"Natl Yunlin Univ Sci & Technol, Dept Civil & Construct Engn",Touliu,Taiwan
5a6cf4c5-3611-4795-bd56-06771d7ca387,"Southwest Jiaotong Univ, Sch Civil Engn, Dept Construct Engn",Chengdu,Peoples R China
790dac7b-dda6-4ffe-be3c-c4d08c00915b,"Northumbria Univ, Dept Architecture & Built Environm",Newcastle,England
92e006dc-00e4-4119-a10a-d371bb4668fc,"Leeds Beckett Univ, Sch Built Environm Engn & Comp, Leeds",W Yorkshire,England
44bef03b-456c-4a7f-a471-2c0419e166ef,"Univ Lancaster, Environm Ctr",Lancaster,England
5bc2749d-54c3-4623-911c-209926397787,"Univ Melbourne, Ctr Spatial Data Infrastruct & Land Adm, Dept Infrastruct Engn, Parkville",Vic 3010,Australia
0ec40c11-826e-4e8d-abaf-73c053d7cb30,"Hunan City Univ, Civil Engn Coll, Yiyang 413000",Hunan,Peoples R China
0fde422f-8d56-4b81-aafd-73f0c7617c92,"CNRS, Arts & Metiers ParisTech, LAMIH, UMR 8201, 151 Blvd Hop",F-75013 Paris,France
a9898ca2-16e4-4feb-8ab8-727729ac18b6,"Univ Polytech Hauls De France, CNRS, LAMIH, UMR 8201",F-59313 Valenciennes,France
419f4b1e-ca00-4c97-b617-5f8cdee01564,Chulalongkorn Univ,Bangkok,Thailand
e2edb4b5-92da-4631-8d03-4c2fa3137514,Univ Hong Kong,Hong Kong,Peoples R China
