affiliation_id,institution_name,city,country
2b0af972-7dc3-4234-affd-fc3cb282695a,"Natl Inst Construct Management & Res, Sch Construct Management, Hyderabad 500101",Telangana,India
a54033f8-6757-4209-8386-ce95612d54b5,"Bangalore Int Airport Ltd, KIAL Rd, Bengaluru 560300",Karnataka,India
9aa16749-7e52-463c-a649-b64fcb2e567a,"Hebei Agr Univ, Urban & Rural Construct Inst, Baoding 071000",Hebei,Peoples R China
8f35ae4a-26f7-44c4-a952-0f0e554f4f82,"Istanbul Tech Univ, Fac Architecture, Dept Architecture",Istanbul,Turkey
e16330a9-4d57-467a-a357-1cf6b41cd7e8,"AL Azhar Univ, Fac Engn, Civil Engn Dept",Cairo,Egypt
5c69abea-c3b9-4b67-9d1b-cc96d2ffd657,"Ain Shams Univ, Fac Engn, Struct Engn Dept",Cairo,Egypt
44017787-4437-4c54-8322-ed46e337e2f8,Univ Ind Santander,Bucaramanga,Colombia
6606f239-b95d-460c-aa09-99d248ed3134,"Univ Catolica Colombia, Bogota",DC,Colombia
6f3be85d-c70c-4f2c-9987-ac6f78ec4998,Pontificia Univ Catolica Valparaiso,Valparaiso,Chile
2780ef59-a10d-440b-b5d0-a39b8e43f962,Univ Politecn Valencia,Valencia,Spain
039965b9-7c19-4555-868e-e28c9ef541b7,"Symbiosis Int Deemed Univ SIU, Symbiosis Inst Technol SIT, Civil Engn Dept, Pune",Maharashtra,India
cf59fa0f-dd60-4dea-a2d3-5f6fc6a7765a,"Loughborough Univ, Sch Architecture Bldg & Civil Engn, Loughborough",Leics,England
d60a8357-405f-4e91-9b96-0d6572637128,"Natl Univ Civil Engn, Fac Construct Econ & Management",Hanoi,Vietnam
3edb5957-9c7e-468c-8db2-1b1763087944,"Ara Inst Canterbury, Engn & Architectural Studies",Christchurch,New Zealand
7ec5db72-e6ea-4f04-bf14-a15825359da8,"Louisiana State Univ, Dept Construct Management, Baton Rouge",LA,United States
04c0a2e4-7a5d-434a-bf35-61fffe0b8012,"Georgia Inst Technol, Coll Design, Atlanta",GA,United States
c84b33a0-ab8d-4b09-92e9-a1906cf6f980,"novaCITYNETS Pte Ltd, Res & Innovat, Cent Singapore",Singapore,Singapore
57ae473e-33bb-42c0-86d3-d3fe875dcf54,"Seoul Natl Univ Sci & Technol, Dept Architectural Engn",Seoul 139743,South Korea
afea1346-3f9b-4e31-90be-1d77df927d04,"Univ Luxembourg, Fac Sci Technol & Med, Campus Kirchberg",L-1359 Luxembourg,Luxembourg
676cc612-f6d1-40c7-8450-0c0423aedba4,"Univ Luxembourg, Fac Sci Technol & Med, Campus Belval",L-4365 Esch Sur Alzette,Luxembourg
47eba9dd-61b2-48e5-88e4-0179af99dc43,"Queensland Univ Technol, Sch Civil Engn & Built Environm, Brisbane",Qld,Australia
c2f0066c-df6d-44a4-9465-6d92c0ebd9b9,"RMIT Univ, Sch Business IT & Logist, Melbourne",Vic,Australia
bbe831af-0a35-47f4-8c78-dd3e4d861ec2,"Xiamen Univ, Huaqiao Univ, Coll Civil Engn",Xiamen,Peoples R China
b90ac25d-39c6-4c70-b984-ea19128d737f,"Hong Kong Univ Sci & Technol, Dept Bldg & Real Estate, Kowloon",Hong Kong,Peoples R China
4fe20230-f937-4d03-b8fd-8a18601edc9c,"Loughborough Univ, Sch Architecture Bldg & Civil Engn, Bldg Informat Management, Loughborough LE11 3TU",Leics,England
c7883727-cc1c-4967-b540-b41af4cbb1e3,"Loughborough Univ, Sch Architecture Bldg & Civil Engn, Construct Management, Loughborough LE11 3TU",Leics,England
4108306e-b05f-4ea6-8482-a27163deddf9,"Pontificia Univ Catolica Valparaiso, Sch Civil Engn, Ave Brasil 2147",Valparaiso 23662804,Chile
f65bd1b7-b554-4503-a52b-f2b39a8860b6,"Pontificia Univ Catolica Chile, Dept Construct Engn & Management, Vicuna Mackenna 4860, Casilla 306, Correo 22",Santiago 7820244,Chile
9f3512f4-9641-4f7e-a4ce-6cb1a7282082,"Univ Politecn Valencia, Sch Civil Engn, Camino Vera S-N",Valencia 46022,Spain
58a074ae-1636-4fcc-b68b-cea507b7afe6,"China Univ Min & Technol, Sch Mech & Civil Engn, Inst Project Management, Xuzhou",Jiangsu,Peoples R China
0ba45843-97fb-4bfd-9323-3f9b6b0f0cbf,"China Univ Min & Technol, Sch Econ & Management, Xuzhou",Jiangsu,Peoples R China
3683c76f-3006-46c4-a342-e1ea6536840d,"Michigan State Univ, Sch Planning Design & Construct, E Lansing",MI,United States
e04d0468-e995-430e-bff4-04067e3d3ecc,"Gebze Tech Univ, Dept Civil Engn",TR-41400 Kocaeli,Turkey
83951d5b-5ae9-46a2-9604-ab7d0a3fe2cb,"Univ Wyoming, Dept Civil & Architectural Engn, Laramie",WY,United States
a1eec5ed-3751-4497-83c1-cd093c4a1ef3,"Aston Univ, Dept Construct Management & Engn, Birmingham",W Midlands,England
43065d7e-5dd7-49e9-afce-08af44e9b3ee,"Obafemi Awolowo Univ, Dept Quant Surveying",Ife,Nigeria
c5741113-b1bd-420c-a623-a0ac366f2968,"Univ Salford, Sch Built Environm, Manchester",Lancs,England
6498e68e-597d-4b5a-a0f8-48419dbc32e0,"Cairo Univ, Fac Engn, Integrated Engn Design Management Program",Giza 12613,Egypt
9ac4865f-57c2-49cb-be08-f27ca2e3afd5,"RIGID Engn Consultants, 27 Maboseen Residence",Giza 12616,Egypt
d1e94dec-d578-4db0-aeb9-c94c3872a06e,"Cairo Univ, Fac Engn, Dept Struct Engn, Construct Engn & Management",Giza 12613,Egypt
b6ce82a8-8632-4fca-bf18-e26bf7994a24,"Shenzhen Univ, Sino Australia Joint Res Ctr BIM & Smart Construc",Shenzhen 518060,Peoples R China
9db02a0e-bc37-4e51-81ea-09f01717cd7a,"Natl Univ Singapore, Dept Bldg",Singapore 117566,Singapore
a039eb71-7e7a-4e63-b583-f7a9dd7abccc,"Ping Insurance Grp Co China Ltd, 5033 Yitian Rd",Shenzhen 518033,Peoples R China
60465bb7-5fce-4d16-9208-3169beb00dbf,"Cent Queensland Univ, Sch Engn & Technol, Sydney",NSW 2000,Australia
aebdbbeb-f29b-4cae-8052-060ecfc0bbfa,"Chongqing Univ, Sch Publ Affairs",Chongqing 400044,Peoples R China
0e85e18f-a391-4fe8-aae3-255c6c77b6b0,"Univ Granada, Civil Engn",Granada,Spain
2f722c4e-70a6-401b-aaff-96056b08f56f,"Univ Granada, Construct & Engn Projects",Granada,Spain
476a63ed-6e64-4a69-a27e-c7923eb4e26a,"Notre Dame Univ Louaize, Civil & Environm Engn",Zouk Mosbeh,Lebanon
0918dbde-702c-4301-a5d8-c62774eb01f0,"Iran Univ Sci & Technol, Dept Civil Engn",Tehran,Iran
252a1687-29b4-466b-9095-75cb5aaa8ef8,"Univ Canberra, Fac Built Environm & Design, Canberra",ACT,Australia
e2ea2a73-6389-4a90-b8d1-5a12155c66fc,HOCHTIEF ViCon,Essen,Germany
9217960d-b57e-4af6-aea1-3dd6980be73b,"Teesside Univ, Sch Comp Engn & Digital Technol, Middlesbrough",Cleveland,England
27a6561f-2197-4b57-9a28-1355d5e9fcfa,"Qatar Univ, Dept Architecture & Urban Planning",Doha,Qatar
2a0679f3-d104-4a16-a7e1-a25d2821cecf,"Govt Sudan, Minist Infrastruct & Transportat",Khartoum,Sudan
373105ac-49b8-4e62-85a5-063bc519aed9,"Univ Portsmouth, Sch Civil Engn & Surveying, Portsmouth PO1 2UP",Hants,England
7a87a093-7252-4be9-9900-195f8de69e5c,"DPR Construct, 315 2nd Ave S Ste 200, Seattle",WA,United States
7efde46f-c34a-498a-a88d-283030ceb1c0,"North Carolina State Univ, 50 Pullen Rd, Raleigh",NC,United States
5c4faf78-a2bd-4760-a220-22567df2ac15,"Tongji Univ, Sch Econ & Management, Dept Construct Management & Real Estate",Shanghai 200092,Peoples R China
3d0ac5ab-a67b-4f4e-ad19-37a4e9f9c04b,"Univ South Australia, Unisa Stem Scarce Resources & Circular Econ SCARC, Adelaide",SA,Australia
e5a1f345-1143-4790-bd0b-1c8ac7f41f00,"Victoria Univ, Newport Campus, Melbourne",Vic,Australia
dcb38373-c85f-46ff-843f-178c2a278624,"City Univ Hong Kong, Dept Architecture & Civil Engn, Kowloon Tong",Hong Kong,Peoples R China
36c2b0c1-a163-4162-96f8-0f51829eafa2,Univ Bolton,Bolton,England
adf68c17-0366-4f31-9047-17f55ced15b6,"Edinburgh Napier Univ, Edinburgh",Midlothian,Scotland
342469e6-2922-434f-81d6-f41a156a7dce,Mansoura Univ,Mansoura,Egypt
4d7e7bb7-4707-420b-a7e4-86b618550d74,"LINEACT CESI, 8 Rue Isabelle Autissier",F-17140 Lagord,France
06df9b36-54fc-41ed-a294-49e32431259b,"ENGIE SOLUT, 15RueNinaSimone",F-44000 Nantes,France
b7534a49-232d-4f1e-8826-d1f94073ace8,"ENSAM Paris, 151 Blvd Hop",F-75013 Paris,France
191e2c8f-25d9-4a38-8e81-a4c6a9935bc2,"LINEACT CESI, Def FR, 1 Ave President Wilson",F-92074 Paris,France
de7ecd88-4ebc-437e-930a-fe205c389dff,"Sichuan Univ, Coll Architecture & Environm",Chengdu,Peoples R China
349a3279-35a2-4619-a4a8-07235bc4d17b,"Univ Adelaide, Sch Architecture & Built Environm, Adelaide",SA,Australia
5d639a1f-b83e-49e0-b4a4-fe241fc0ec83,"Cent Queensland Univ, Dept Min Built Environm, Rockhampton",Qld,Australia
76f57422-3f4d-48d5-acdf-4108fc2d4cff,"Ara Inst Canterbury, Engn & Architectural Studies",Christchurch 8011,New Zealand
23ab1491-a907-4838-8e9e-3c02aa737443,"Univ Teknol Malaysia, Fac Engn, Sch Civil Engn",Skudai 81310,Malaysia
2b1d93bc-b516-4260-a28a-1c4552d87e7b,"Hong Kong Polytech Univ, Fac Construct & Environm FCE, Dept Bldg & Real Estate BRE, Hung Hom, Kowloon",Hong Kong,Peoples R China
296b2826-74b7-46c3-ab07-c20c561dbe89,"Birmingham City Univ, Sch Engn & Built Environm, Birmingham B4 7BD",W Midlands,England
e367c6a1-6c0f-4334-a6d6-010c73a5e70b,"Univ Johannesburg, Fac Engn & Built Environm",ZA-2092 Johannesburg,South Africa
53519f28-4856-4df4-b575-d494941b908f,"Cent South Univ, Sch Civil Engn, Dept Engn Management",Changsha 410075,Peoples R China
94737ac1-2c39-40d5-8a27-eb9d54f16d92,CNPC Managers Training Inst,Beijing 100096,Peoples R China
9cf29376-41de-48e9-b33e-0b5246ccf2ed,"Anhui Jianzhu Univ, Sch Elect & Informat Engn",Hefei 230601,Peoples R China
1c0ca276-0fc7-49fd-8c94-1d28d506473e,"Ohio State Univ, Columbus",OH,United States
9a532705-9252-4e3a-8ba5-4fc64c3616d4,"Huazhong Univ Sci & Technol, Hubei Engn Res Ctr Virtual Safe & Automated Const",Wuhan,Peoples R China
794b0f74-10a1-4641-9ac3-13d8206141ec,"Huazhong Univ Sci & Technol, Sch Civil & Hydraul Engn",Wuhan,Peoples R China
216dd4a9-09cb-4b80-94ca-1bd89a6dc61e,"Univ Texas Austin, Dept Civil Architectural & Environm Engn, 301 E Dean Keeton St C1752, Austin",TX,United States
ec148ca0-a7d0-44b6-9750-9490a9f908d1,"Univ Texas Austin, Dept Civil Architectural & Environm Engn, Construct Engn & Project Management Program, Engn, 301 E Dean Keeton St C1752, Austin",TX,United States
81478da1-c2a9-447c-b6a6-25bbd260b4d9,"Univ Canterbury, Sch Engn, Dept Civil & Nat Resources Engn",Christchurch 8041,New Zealand
240ce8de-59af-4410-bf0e-0c994c936870,"Pandit Deendayal Petr Univ, Sch Technol, Dept Civil Engn",Gandhinagar 382007,India
54df23a2-bb92-46da-8aae-4fece0d70e8e,"Adani Inst Infrastruct Engn, Dept Informat & Commun Technol, Ahmadabad 382421",Gujarat,India
c2944073-ff71-4ce2-9759-5bf54a1ae0d0,"Univ Florida, Rinker Sch Construct Management, Gainesville",FL,United States
61575554-bd27-4a41-b368-c1eca20b1546,"Glodon, CTO Off, Technol Platform Ctr",Beijing,Peoples R China
f39fd297-4c96-4962-8c01-ee3656a61ebc,"Cairo Univ, Struct Engn Dept",Giza,Egypt
05ec69a7-ce0b-420f-9f77-4898e4082755,"British Univ Egypt, Dept Architectural Engn",Cairo,Egypt
60e6fff1-fe02-4bff-892f-4ca8f6aba933,"Univ West England, Dept Architecture & Built Environm, Bristol",Avon,England
c6922cff-06e2-4b8d-9e72-2c0c80354787,"Univ Johannesburg, Dept Construct Management & Quant Surveying",Johannesburg,South Africa
fd719b4f-2ddc-4452-9db9-4ef0abff7e6a,China Railway Grp,Belgrade,Serbia
f6427d40-0e30-4d8e-aa49-399da97d6bf0,"Coventry Univ, Sch Energy Construct & Environm, Coventry",W Midlands,England
b2fc8f7e-720a-40ef-8c2d-4302e1343c11,"Univ Cambridge, Inst Mfg, Dept Engn, 17 Charles Babbage Rd",Cambridge CB3 0FS,England
bf2e4a3f-c6fc-410d-b9a6-b5bf07518ba2,"Univ Cambridge, Ctr Smart Infrastruct & Construct, Dept Engn, Trumpington St",Cambridge CB2 1PZ,England
d0546488-6316-4ced-a75e-4c6e1815c876,"Univ Manchester, Manchester",Lancs,England
4542471f-62d6-45ab-8a44-0715c5506e8f,"Kwame Nkrumah Univ Sci & Technol, Dept Construct Technol & Management",Kumasi,Ghana
f4789ba5-49fc-44c2-b47f-7827877a43ee,Cent Univ Technol Free State,Bloemfontein,South Africa
fd2cd7e6-640c-419f-9767-e4ddcdb990eb,"China Univ Geosci Beijing, Sch Engn & Technol",Beijing,Peoples R China
26cdde99-7e60-401c-b5f7-2ea4cc05d3e6,"Minist Transport, Res Inst Highway",Beijing,Peoples R China
79842fdb-d1b7-4569-b5af-13a3d505f936,"Huaqiao Univ, Sch Civil Engn",Xiamen,Peoples R China
b23b6b8c-4e29-4800-96fd-66b5d4b5e5fd,Supervis Bur Traff Construct Qual & Safety Fujian,Fuzhou,Peoples R China
be60eaea-ee2a-49c6-9d49-f2134e728794,"Natl Univ Civil Engn, 55 Giai Phong Rd",Hanoi,Vietnam
ff32c26a-e446-4ff6-9ab0-dee6c22a1f92,Jimma Inst Technol,Jimma,Ethiopia
dbecb2a6-9d81-48fe-b5d3-45c8787de3ee,"Texas Tech Univ, Lubbock",TX,United States
d01be6c8-b922-479d-a361-adb6adea84ff,"Univ Nebraska, Lincoln",NE,United States
52cb93ab-6a1b-41e6-b7a9-ab01782b5c62,"Bahir Dar Univ, Fac Civil & Water Resources Engn",Bahir Dar,Ethiopia
9340ace7-8168-4b98-b6e5-6ba1729a8d3c,"Univ Nebraska, Peter Kiewit Inst, Durham Sch Architectural Engn & Construct, 1110 S 67th St, Omaha",NE,United States
250f80d2-435f-4a5c-a4d5-860c6dc0a358,"Mississippi State Univ, Coll Architecture Art & Design, 123-D Howell Bldg, Starkville",MS,United States
cb1b9a94-abe1-44c9-90be-7b2cf33985f5,"Deakin Univ, Sch Architecture & Built Environm, Geelong Waterfront Campus, Locked Bag 20001, Geelong",Vic 3220,Australia
b656d0a8-7916-40a1-acd9-4e06c9bdb5db,"Univ Southern Queensland, Sch Civil Engn & Surveying, Springfield",Qld 4300,Australia
9ea6a580-c8f8-4934-bd32-f4f526fc6cc3,"Keimyung Univ, Sch Med, Dept Immunol",Daegu 42601,South Korea
810c819e-67aa-47a3-99b9-1765cfe86279,"Daegu Gyeongbuk Med Innovat Fdn DGMIF, New Drug Dev Ctr",Daegu,South Korea
9bf04acd-9932-4e06-9c01-8b50dd8d6695,"Keimyung Univ, Ctr Forens Pharmaceut Sci",Daegu,South Korea
da3669cb-2213-4cb3-a72c-a3e2d4846f23,"Istanbul Tech Univ, Dept Civil Engn",TR-34469 Istanbul,Turkey
8f57ba71-a0a6-49f5-96f4-d062833eff8d,"Univ New South Wales, Sch Civil & Environm Engn, Sydney",NSW,Australia
d94a94c4-97c5-4082-a76e-791b045199f4,"Univ New South Wales, Sch Architecture & Design, Sydney",NSW,Australia
7e6e255a-7f1a-45d6-874c-8b120601b7ae,"Ningbo Univ, Fac Architecture Civil Engn & Environm, Ningbo",Zhejiang,Peoples R China
555622c8-4a9b-45f6-acab-c86648e995c9,"China Univ Geosci, Sch Comp Sci, Wuhan",Hubei,Peoples R China
c705612c-74ff-434a-a720-62138ce70f35,"Zhongnan Univ Econ & Law, Sch Business Adm, Wuhan",Hubei,Peoples R China
aeef9f04-8ca4-4de1-a967-b88e9b34547e,"Univ East Anglia, Sch Comp Sci, Norwich NR4 7TJ",Norfolk,England
3c678edb-ac5d-4e8d-baa2-9ad52835dbe5,"Hong Kong Polytech Univ, Res Inst Sustainable Urban Dev",Hong Kong,Peoples R China
a738d65d-8db6-47c0-a482-14c69fbb450c,Univ Westminster,London,England
c963d9bc-425c-42d8-918f-845b4ecbe888,"Univ Cape Town, Dept Construct Econ & Management",Cape Town,South Africa
ff68c2f2-dc54-4839-a86c-027bd8c14680,"Shenzhen Univ, Key Lab Coastal Urban Resilient Infrastruct MOE",Shenzhen,Peoples R China
8483b299-d1e4-46c6-844a-dd3a24f221cd,"Shenzhen Univ, Sino Australia Joint Res Ctr BIM & Smart Construc",Shenzhen,Peoples R China
9ea304f3-e6e6-41c3-a26c-1cbd727e9b4c,"Shenzhen Univ, Coll Civil & Transportat Engn, Dept Construct Management & Real Estate",Shenzhen,Peoples R China
5855363a-b911-4d11-a1f4-80b940813c90,"Univ Shenzhen, Shenzhen Key Lab Green Efficient & Intelligent Co",Shenzhen,Peoples R China
2e74c334-4ecf-464f-8e5e-d22605195a49,TY Lin Chongqing Int Engn Technol Co Ltd,Chongqing,Peoples R China
18048e8a-2bf0-476a-a119-2837bf70b4e0,"Guangdong Univ Foreign Studies, Sch Accounting, Res Ctr Accounting & Econ Dev Guangdong Hong Kong",Guangzhou,Peoples R China
afd791c6-a23f-426d-8bd3-48714021b420,"Guangdong Univ Foreign Studies, Sch Accounting",Guangzhou,Peoples R China
60cbd83b-b4dd-4d64-bcf0-aa1bb9171d53,"Wenzhou Univ, Coll Civil Engn & Architecture",Wenzhou 325025,Peoples R China
e1c5043f-6270-475a-8297-becc280b6c51,Sichuan Univ,Chengdu,Peoples R China
1345fe02-b72b-4f6f-8323-4ae208c7d192,"Sichuan Univ, Sch Architecture & Environm",Chengdu,Peoples R China
25298449-00be-4ce3-8cce-aaf86ef0b80a,"Oxford Brookes Univ, Sch Built Environm",Oxford OX3 0BP,England
75f9535b-3428-42f6-a70f-15b3bbda7275,"Univ Yaounde I, Natl Adv Sch Engn, Dept Civil Engn, POB 8390",Yaounde,Cameroon
3d3a1788-f87c-4cc4-91f4-57d434ec2be1,"Ecole Natl Super Travaux Publ, Rue Elig Efi, POB 510",Yaounde,Cameroon
8fcf8005-5532-4651-9812-4f731549e783,"Jiangsu Univ, Sch Management, Zhenjiang",Jiangsu,Peoples R China
0d84276d-b073-400c-84b8-c26a92941f81,"Curtin Univ, Sch Built Environm, Australasian Joint Res Ctr Bldg Informat Modellin, Perth",WA,Australia
cd0481e5-25f6-48c7-bf34-b019f588971e,"Deakin Univ Geelong Waterfront Campus, Sch Architecture & Built Environm, Geelong",Vic,Australia
2e435758-0b1e-463b-9ec8-682e56289015,"Univ Extremadura, Sch Technol, Dept Construct, Avda Univ S-N",Caceres,Spain
ec781964-9ba0-4d6e-a613-53eb8dfd9c6c,"Univ Isabel I, Dept Educ, Area Knowledge Elect Technol",Burgos,Spain
20e365e8-83f1-4273-b199-ce9b8b49bb59,"Southwest Jiaotong Univ, Sch Econ & Management, Chengdu 610000",Sichuan,Peoples R China
ca4cf9de-c6d5-46f5-afbf-3875d4f29c54,"Torrens Univ Australia, Res Off, Sydney",NSW 2000,Australia
c2857723-5a87-436d-b860-114232efb638,"Bradley Univ, Business & Engn Convergence Ctr, Peoria",IL,United States
34289684-6382-42aa-8f07-ea718367f4ba,Oxford Brookes Univ,Oxford,England
2558dce9-ecf9-4274-9f3b-4eae6e259dec,"Oxford Brookes Univ, Oxford Inst Sustainable Dev",Oxford,England
4e10ff60-1246-41ca-a930-0f6086bf22b8,"Univ Bolton, Sch Engn",Bolton,England
40cf66c2-3480-4ead-bac0-9801c1f69818,"Federico II Univ Naples, Dept Civil Construct & Environm Engn",I-80125 Naples,Italy
f8ccd253-4ca8-4945-8cb9-a4fade928404,"Univ Maribor, Fac Civil Engn Transportat Engn & Architecture",Maribor 2000,Slovenia
140e46d6-8090-4332-94e9-ca9670a2a6fc,"Texas A&M Univ, Dept Construct Sci, College Stn",TX,United States
ee2bf412-cd52-4632-aa1f-e8bfdbdb9901,"Sapienza Univ Rome, Dept Civil Construct & Environm Engn, Via Eudossiana 18",I-00184 Rome,Italy
1af637db-95bc-4fe1-a615-f12daa12924a,"Sapienza Univ Rome, Dept Hist Representat & Conservat Architecture, Piazza Borghese 9",I-00186 Rome,Italy
3f3b21ec-313e-484d-be59-93ea5ac42513,"Chongqing Univ, Sch Construct Management & Real Estate",Chongqing,Peoples R China
9173d4e8-fa21-48a1-ab33-eb86f3eac5e8,"Natl Cent Univ, Grad Inst Construct Engn & Management, Coll Engn",Jhongli,Taiwan
b1c7abb7-2f35-420f-967c-d76449dcb562,"Univ Twente, Fac Engn Technol, Dept Civil Engn",Enschede,Netherlands
efdd9ba9-903a-4344-a7de-576adee343b3,"Univ Twente, Fac Behav Management & Social Sci, Dept Educ Sci",Enschede,Netherlands
86a1862e-2b62-4902-aa55-eda8a69b7930,"Univ Huddersfield, Dept Art Design & Architecture, Huddersfield",W Yorkshire,England
eb878b53-a3e3-4e89-93ec-bf1420d58a9d,"Galway Mayo Inst Technol, Dept Bldg & Civil Engn",Gaillimh,Ireland
82e208d8-462c-42a0-98a7-cf3e9ae82ed2,"Hong Kong Polytech Univ, Dept Bldg & Real Estate, Joint Program, Hung Hom, 11 Yuk Choi Rd, Kowloon",Hong Kong,Peoples R China
d1774d67-7701-41b1-baeb-f7f9210d6b30,"Sichuan Univ, Coll Architecture & Environ, 24 South Sect 1, Yihuan Rd",Chengdu 610065,Peoples R China
8f0735ba-6132-4b80-a870-66532b496617,"Hong Kong Polytech Univ, Dept Bldg & Real Estate, Fac Construct & Environm, Hung Hom, Kowloon",Hong Kong,Peoples R China
a26ec0ea-afbc-43a1-ba56-e0f06d0e8253,"Tongji Univ, Sch Econ & Management, 1239 Siping Rd",Shanghai 200092,Peoples R China
71724ed4-73d7-41d1-ab74-2a8b93f7f24b,"China Acad Bldg Res, Dept Stand & Codes, 30 North 3rd Ring Rd",Beijing 100013,Peoples R China
8509cf3e-cc5a-4c42-a1c6-42dc11f7f9a4,"Hong Kong Polytech Univ, Dept Bldg & Real Estate, Hung Hom, 11 Yuk Choi Rd, Kowloon",Hong Kong,Peoples R China
1d165419-73cf-4fa0-9a99-023bc45c501d,"Fuzhou Univ, Coll Civil Engn, 2 Xue Yuan Rd",Fuzhou 350116,Peoples R China
cd8489e6-b417-4e4a-b70e-daa704bff334,"Fuzhou Univ, Coll Civil Engn, 2 Xue Yuan Rd",Fuzhou 350108,Peoples R China
35e2ea11-6c67-4038-ae66-c127392ca885,"Middlesex Univ, Dept Design Engn & Math, Fac Sci & Technol",London NW4 4BT,England
044db114-5e1e-4764-a990-288334d7667c,"Univ Salford, Sch Built Environm, Salford",Lancs,England
4da3142e-34d1-4889-8751-b0fe0142f40f,"Univ Lagos, Dept Quant Surveying",Lagos,Nigeria
e81ebfb0-8698-42e8-bcef-99fb8a3d7c05,"Curtin Univ, Construct Management, Perth",WA,Australia
a495c3e4-8827-4730-8890-4bd101f56ef9,"Curtin Univ, Perth",WA,Australia
7111fa3d-e20d-4906-8967-972e1e1cdcb6,"Virginia Tech, Blacksburg",VA,United States
cb26bdfb-c8d9-4bb6-b87a-b1e094ea217d,"Shenzhen Polytech, Sch Construct & Environm Engn",Shenzhen,Peoples R China
3a7bb872-3e06-4f5a-b8f6-1c6ecdc9e955,"Beijing Univ Civil Engn & Architecture, Sch Urban Econ & Management",Beijing,Peoples R China
9a0c984a-1c04-4d05-a0e7-7500588010cd,"Tianjin Univ, Coll Management & Econ",Tianjin,Peoples R China
3adff5a8-f652-4781-971c-68e92f6d6a63,ShenZhen Dongsen Construct Project Management Co,Shenzhen,Peoples R China
1d751671-440c-4d02-8354-85a953e4c791,"Natl Univ Singapore, Sch Design & Environm, Dept Bldg",Singapore 117566,Singapore
84bf5a37-524b-4974-88eb-615420aefd9a,"Hong Kong Polytech Univ, Dept Bldg & Real Estate",Hong Kong 999077,Peoples R China
f29191f9-9d05-4cc0-8667-f48202731d40,"South China Univ Technol, Sch Design, Guangzhou 510006",Guangdong,Peoples R China
1b628d21-d0fc-4daf-84b2-87d98694e139,"Loughborough Univ, Sch Architecture Bldg & Civil Engn, Loughborough LE11 3TT",Leics,England
212514c9-9fac-4d99-a6d4-b831ac155ae2,"Woosong Univ, Dept Railrd Construct Syst Engn, 171 Dongdaejeon Ro",Dejeon 34606,South Korea
a6a2b784-9aaa-4d08-99bf-42bb23d54370,"Hanyang Univ ERICA, Sch Architecture & Architectural Engn, 55 Hanyangdaehak Ro",Ansan 15588,South Korea
db1fcb31-11aa-410e-8484-2dc6865f159b,"Beijing Univ Civil Engn & Architecture, Sch Elect & Informat Engn",Beijing,Peoples R China
ecf959bd-5063-42ab-9e14-b4d0bba57fd1,"Univ West England, Architecture & Built Environm, Bristol",Avon,England
e2a0cff7-5418-4407-8885-e1f6a5ff320a,"Leeds Beckett Univ, Construct Project Management & Innovat, Leeds",W Yorkshire,England
065174fd-bb06-4d9b-a2f0-7f6989edc7b9,"Queens Univ Belfast, Sch Nat & Built Environm, Belfast",Antrim,Northern Ireland
69e080a8-24d6-4b6d-bb2b-2e8e94af85af,"Technion Israel Inst Technol, Fac Civil & Environm Engn, Virtual Construct Lab",IL-3200003 Haifa,Israel
3f6a4e12-1ea7-4323-84f1-7a46517c5a6d,"Univ Minho, Inst Sustainabil & Innovat Struct Engn",P-4800058 Guimaraes,Portugal
63306501-212c-46be-a27a-fa1be1a908d0,"Univ Minho, Sch Engn, Civil Engn Dept",P-4800058 Guimaraes,Portugal
349ae614-c38a-446c-8627-c4d24a128d14,"Univ West England UWE Bristol, Fac Business & Law, Big Data Enterprise & Artificial Intelligence Lab, Coldharbour Lane, Bristol BS16 1QY",Avon,England
6f32abf8-5748-42ef-9095-bec9ce1ac805,"Missouri Univ Sci & Technol, Dept Civil Architectural & Environm Engn, 218 Butler Carlton Hall, 1401 N Pine St, Rolla",MO,United States
d8b63fdc-9b8c-469f-a30b-4eabfe87d8ce,"Missouri Univ Sci & Technol, Dept Engn Management & Syst Engn, Construct Engn & Management, 228 Butler Carlton Hall, 1401 N Pine St, Rolla",MO,United States
59395af6-0ff1-47cc-80ce-894278fb47df,"Missouri Univ Sci & Technol, Dept Engn Management & Syst Engn, Civil Engn, 228 Butler Carlton Hall, 1401 N Pine St, Rolla",MO,United States
806929fc-d49f-4313-8d99-409cf590db61,"Missouri Univ Sci & Technol, Dept Engn Management & Syst Engn, Dept Civil Architectural & Environm Engn, Missouri Consortium Construct Innovat, 228 Butler Carlton Hall, 1401 N Pine St, Rolla",MO,United States
c542ce5d-f75d-4cbe-a306-22f81b243f4e,"Construct & Reconstruct Engn Co, Bldg 93-B, Km 28 Cairo Alexandria Desert Rd",Giza 12566,Egypt
c1040d77-db5a-4c90-8d55-916b4efd4d72,"Dorra Grp, Bldg 93-B, Km 28 Cairo Alexandria Desert Rd",Giza 12566,Egypt
8016bdce-e9ea-40ad-b2ac-69b66a1e67b5,"Univ Tennessee, Dept Civil & Environm Engn, 851 Neyland Dr, 417 John D Tickle Bldg, Knoxville",TN,United States
65031fb6-036f-42b0-8b9b-8c6fedb0f7e0,"Univ Tennessee, Dept Civil & Environm Engn, 325 John D Tickle Bldg, Knoxville",TN,United States
f35ce43e-4443-4a85-b740-c3f9ce6b8f2f,"Missouri Univ Sci & Technol, Dept Civil Architectural & Environm Engn, Butler Carlton Hall, 1401 N Pine St, Rolla",MO,United States
09159556-de11-4552-a506-6dc809fb3f1e,"Islamic Azad Univ, Dept Civil Engn, Isfahan Khorasgan Branch",Esfahan,Iran
29915064-1285-4e07-b0f7-50af71323dad,"Univ Teknol Malaysia, Fac Civil Engn, Johor Baharu",Skudai,Malaysia
e2ba0dca-5382-433a-8165-921706fe8a42,"Bahcesehir Univ, Fac Architecture & Design",Istanbul,Turkey
e62aa8ef-5076-49e0-9209-0f3859c7de12,"Delft Univ Technol, Fac Architecture & Built Environm",Delft,Netherlands
5b5f8773-f6c4-454a-9bfb-de53a07ff1cc,"Univ Reading, Sch Built Environm, Reading RG6 6AH",Berks,England
89ebf0d1-5fcc-4fba-ab22-18abe108190c,"Univ Teknol Malaysia, Razak Fac Technol & Informat, Level 7, Razak Tower, Jalan Sultan Yahya Petra",Kuala Lumpur 54100,Malaysia
51a33788-c541-4559-bf94-0267c4645705,"Univ Malaysia Pahang, Fac Ind Management, Lebuhraya Tun Razak, Kuantan 26300",Pahang,Malaysia
9c9301f2-6f75-4533-89a3-1592309fdb29,"Univ Teknol Malaysia, Occupat Safety Hlth & Environm Unit, Jalan Sultan Yahya",Kuala Lumpur 54100,Malaysia
bcf1cc22-956a-44d9-a3cf-994676f6a846,"Flinders Univ S Australia, Coll Sci & Engn, Adelaide",SA,Australia
e49848bd-dd2d-41c1-85be-ac399b53e845,"Univ Manchester, Programme Director Construct Project Management, Dept Mech Aerosp & Civil Engn, Manchester M1 7JR",Lancs,England
d9114008-3743-4904-8a96-4b77f127f3bb,"Amirkabir Univ Technol, Tehran Polytech, Dept Civil & Environm Engn",Tehran,Iran
94ce8607-99c0-4028-a9be-c3f687af9dc8,"Univ Tehran, Sch Civil Engn, Coll Engn",Tehran,Iran
2c3b7d39-3650-4d19-bf93-0606a131d120,"Univ Sao Paulo, Inst Architecture & Urbanism",Sao Carlos,Brazil
402346f2-45a9-4d78-9450-c1054362b9bc,"Univ Bath, Dept Architecture & Civil Engn, Bath",Avon,England
978038bc-a260-46c8-88ac-55514d488914,"Pontifical Catholic Univ Peru, Dept Engn",Lima,Peru
0a87c27f-72c2-4cd9-8f0c-71fb29fb7111,"Univ Technol Malaysia, Sch Comp",Skudai,Malaysia
f4f211fd-887d-484e-a272-2af7571aeceb,"Univ Sargodha, Dept Comp Sci & IT",Punjab,Pakistan
60405cc3-27b5-4de8-8ddd-7784b10de836,"Univ Technol Malaysia, Fac Built Environm, Dept Architecture",Skudai,Malaysia
d952f50f-a8a9-4403-a0f5-cd2576ab50a3,"Natl Univ Sci & Technol, NUST Coll Civil Engn, Dept Construct Engn & Management CE&M, Risalpur Campus",Risalpur 24080,Pakistan
33355711-e458-4422-b318-d84a5bf3c428,"King Khalid Univ, Coll Engn, Dept Civil Engn",Abha 61421,Saudi Arabia
