affiliation_id,institution_name,city,country
a4dfe842-24b5-4b87-bf84-4e4a3cab4f29,"Jomo Kenyatta Univ Agr & Technol, Ctr Urban Studies",Nairobi,Kenya
26aeb834-fb27-48cb-885a-9e82f9fe801f,"Victoria Univ, Inst Sustainable Ind & Liveable Cities, POB 14428, Melbourne",Vic 8001,Australia
777dc367-96ec-458b-84e9-c99290c276e4,"King Fahd Univ Petr & Minerals, Architectural Engn & Construct Management Dept",Dhahran,Saudi Arabia
9b1c63fc-d2be-4691-b37d-1dbe0b38e304,"King Fahd Univ Petr & Minerals, Interdisciplinary Res Ctr Construct & Bldg Mat",Dhahran,Saudi Arabia
88283f2b-e168-48b4-95fb-41cd9e606947,"King Fahd Univ Petr & Minerals, Interdisciplinary Res Ctr Smart Mobil & Logist",Dhahran,Saudi Arabia
7ba23db2-ace0-49b2-a7be-57d439c58ed7,"Delft Univ Technol, Fac Architecture & Built Environm, Julianalaan 134",NL-2628 BL Delft,Netherlands
d22ab55f-6a32-4851-be51-27374a02a399,"TNB Power Generat Sdn Bhd, PJX HM Shah Tower, Jalan Persiaran Barat, Petaling Jaya 46500",Selangor,Malaysia
ac14c35f-878d-4a86-9920-1a3146062799,"Univ Tunku Abdul Rahman, Lee Kong Chien Fac Engn & Sci, Dept Civil Engn, Kajang 43000",Selangor,Malaysia
c6eaaa16-6c98-47ec-a065-06889565fba9,"Univ Putra Malaysia, Fac Engn, Dept Civil Engn, Seri Kembangan 43400",Selangor,Malaysia
681953e5-1483-4568-bea9-148263569fb5,"Univ Putra Malaysia, Fac Design & Architectural, Dept Ind Design, Seri Kembangan 43400",Selangor,Malaysia
f826c95f-b73d-470c-bf64-6a7381059eaa,"Sharif Univ Technol, Dept Civil Engn, 427 Azadi St",Tehran 1458889694,Iran
9ba9ba5e-c1c0-49b3-a168-7853cac7d29f,"Mississippi State Univ, Coll Architecture Art & Design, Statesville",NC,United States
89f36248-f32f-414e-bd04-733b459d9f63,"Istanbul Arel Univ, Fac Engn",TR-34537 Istanbul,Turkey
8add34bc-d2d3-492b-83e6-bcbd408ffbf4,"Univ Reading, Sch Built Environm",Reading RG6 6AB,England
d64ec588-5242-44a5-9021-efc08c7daa22,"Yildiz Tech Univ, Fac Civil Engn, TR-34220 Istanbul, Turkiye; Istanbul Kent Univ, Fac Art & Design",TR-34406 Istanbul,Turkey
eb3b7ab9-edaf-4177-beb0-48bd3cef1a04,"Fujian Univ Technol, Coll Civil Engn",Fuzhou 350116,Peoples R China
f64ee4bf-8999-4ef1-8dd5-50c8391b0edd,"Dalian Univ Technol, Sch Infrastruct Engn, Dalian",Liaoning,Peoples R China
c17ab89a-cc76-4ca0-b884-4caf645fc97f,"Dalian Univ Technol, Sch Control Sci & Engn, Dalian",Liaoning,Peoples R China
f969d7a5-ca91-46f8-a709-9e781fe2eb51,"Univ Sao Paulo, Inst Ciencias Biomed, Sao Paulo",SP,Brazil
175e669d-6deb-444e-9af8-41a8b5a438e9,"Inst Invest Imunol, Inst Nacl Ciencia Tecnol INCT",Sao Paulo,Brazil
ad5b768d-9151-409b-ada0-ea5dbb2fe862,"Univ Fed Sao Paulo, Ctr Terapia Celular Mol CTCMol, Sao Paulo",SP,Brazil
5bf8da05-b636-4379-9ff8-4bfa72854614,"Univ Fed Sao Paulo, Dept Farmacol, Escola Paulista Med",Sao Paulo,Brazil
f07eb8e6-ba8c-4c29-b4c3-3c6681c3fc43,"Natl Univ Singapore, Coll Design & Engn, Dept Civil & Environm Engn",Singapore 117576,Singapore
f525089d-a991-40f2-aa8b-cd0e6864cf7e,"Vrije Univ Brussel VUB, Pl Laan 2",B-1050 Brussels,Belgium
1ceb1bb5-695a-410f-bcd1-37509cdc8185,"Univ Lisbon, CERIS, Inst Super Tecn, Ave Rovisco Pais 1",P-1049001 Lisbon,Portugal
e9af8f54-0581-4bc0-a89d-9b2a5a6d0d46,"Yale New Haven Hosp, Yale Sch Med, Dept Pathol, New Haven",CT,United States
28cef21a-e940-433e-aded-25bf649e0878,"Harvard Med Sch, Brigham & Womens Hosp, Dept Pathol, Boston",MA,United States
f9933905-29ee-439c-b1d0-6d0c552a5d86,"Univ Wisconsin, Med Ctr, Dept Pathol, Madison",WI,United States
29c4f5ad-8200-440e-b8ec-65aec2711e7d,"Ohio State Univ, Dept Biomed Informat, Columbus",OH,United States
91455cad-9fcb-434c-bb48-60fdf80be272,"BI Norwegian Business Sch, Dept Leadership & Org Behav, Nydalsveien 37",N-0484 Oslo,Norway
bed7ef74-6a7e-4526-b1a0-3571df063dbf,"Fed Univ Technol Akure, Dept Quant Surveying",Akure 340110,Nigeria
4e2ced09-b4b7-4724-a294-62ecc48ef946,"Canadian Int Coll CIC, Dept Civil Engn, Zayed Campus, 6th October City 12577",Giza,Egypt
3e9cba31-9b70-451b-a242-b4f17c40ac0e,"Univ Johannesburg, Fac Engn & Built Environm, CIDB Ctr Excellence",ZA-2092 Johannesburg,South Africa
4ff9eaf0-6835-4d5d-bdc4-399f95276ed3,"Univ Sains Malaysia, Sch Social Sci",George Town 11800,Malaysia
55618171-e1c2-4294-8ac2-54610fa6b697,"Victoria Univ Wellington, Wellington Sch Architecture",Wellington 6140,New Zealand
3899137d-813a-45fd-8fba-97b04c2dcbff,Xihua Univ,Chengdu,Peoples R China
31c5a309-fb31-4597-929e-4c8688049fff,Chengdu Urban Investment Land Grp Co Ltd,Chengdu,Peoples R China
5d5776a3-08ea-430e-9d26-bb0bd3c300f0,Chengdu Univ Technol,Chengdu,Peoples R China
fddb38c6-9f9d-4501-9da5-65a3fb864654,"Northumbria Univ, Digital Built Environm Res Grp, Newcastle Upon Tyne NE7 7YT",Tyne & Wear,England
85a7ad1e-381d-4211-bfeb-a57b16da1caf,"CESI Ecole Ingenieurs, Ctr Paris Nanterre",F-92000 Nanterre,France
c676674a-195d-4fd0-a8c2-fbd76e7e6a76,Vietnam Natl Univ Ho Chi Minh City,Ho Chi Minh City,Vietnam
49870dd9-b492-410b-9b5e-143a6b8da978,"Tech Univ Kosice, Inst Technol Econ & Management Construct, Fac Civil Engn",Kosice 04001,Slovakia
d14df935-a68b-4cd1-be00-dffab1ff85b5,"Tech Univ Kosice, Fac Civil Engn, Bldg Serv Dept",Kosice 04001,Slovakia
4db5328c-76ab-4498-aa92-a7352e034ab3,"Tech Univ Kosice, Fac Elect Engn & Informat, Dept Cybernet & Artificial Intelligence",Kosice 04001,Slovakia
23aa7ee7-d132-4baa-a94d-0d033dd816e0,"Massey Univ, Sch Built Environm",Palmerston North,New Zealand
5dc45bb8-7e99-45a2-b9fe-dc6b17467c3a,"Cent South Univ, Sch Civil Engn",Changsha,Peoples R China
289ba9df-e88f-474c-b633-3b50735a43ab,"Xian Univ Architecture & Technol, Xian",Shaanxi,Peoples R China
06599a59-0aba-4b11-a005-2341b7b20543,"McMaster Univ, Dept Chem & Chem Biol, Hamilton",ON,Canada
5b311b75-e3a8-4765-a9c7-49d953cf3e96,"Sunnybrook Res Inst, Biol Sci, Toronto",ON,Canada
65d3a96c-a8a2-410a-822b-54968dd5c784,"Univ Toronto, Dept Med Biophys, Toronto",ON,Canada
1e0a9b9b-2c62-4fdd-8387-fd14443b3507,"Univ Toronto, Dept Biochem, Toronto",ON,Canada
bffc7caf-139a-4725-b94f-676d9ac6da39,"McMaster Univ, Dept Med, Hamilton",ON,Canada
d5405e8d-edb8-4006-99aa-f0c4ae43c95f,"Univ Oklahoma, Hlth Sci Ctr, Dept Biochem, Oklahoma City",OK,United States
9660b0c9-a381-4868-a4e3-61dc825dd369,"Univ Oklahoma, Hlth Sci Ctr, Mol Biol, Oklahoma City",OK,United States
0b5690f0-f798-4087-91b0-3f249d151797,"Univ Oklahoma, Hlth Sci Ctr, Stephenson Canc Ctr, Oklahoma City",OK,United States
e9dcf6ed-c758-49a8-b06e-6ca90859656e,"Graz Univ Technol, Inst Interact Syst & Data Sci",Graz,Austria
3368a986-7c4b-4e16-ae40-b898d2b9839b,"Graz Univ Technol, Inst Software Technol",Graz,Austria
2c8cdcea-5807-413b-b232-01ac86c5d45c,Univ Sao Paulo,Sao Paulo,Brazil
45f2f9bc-0ac0-4d7a-97c9-bb18d0bc3a40,"Georgia Inst Technol, Atlanta",GA,United States
9afe247a-309b-41ec-8da9-68013012594d,"UMa Univ Madeira, FCEE Fac Exact Sci & Engn, DECG Dept Civil Engn & Geol",Funchal,Portugal
0df68189-7651-4bc2-9af9-c7c319058d43,"Univ Porto, Fac Engn FEUP, CONSTRUCT LABEST",Porto,Portugal
34f40d28-4a6e-4192-a643-0204ab894c93,"Hong Kong Polytech Univ, Dept Bldg & Real Estate, Kowloon",Hong Kong,Peoples R China
83b02364-9501-48e0-81b3-776a460c8683,"Jiangxi Engn Vocat Coll, Nanchang 330025",Jiangxi,Peoples R China
dab50579-1332-4314-ad17-4a10911b408a,"Univ Duhok, Coll Engn, Civil Engn Dept",Kurdistan,Iraq
4c85b737-d3be-4056-87f0-eb06587f1b58,"Univ Duhok, Coll Engn, Surveying Engn Dept",Kurdistan,Iraq
824e9ec2-4a9f-44a7-a1f0-02a9673b4e87,"Huazhong Univ Sci & Technol, Sch Civil Engn & Mech, Dept Construct Management, Wuhan 430074",Hubei,Peoples R China
fd4cf2d4-937a-41c6-bbac-d6cc114a8c9a,"Hubei Engn Res Ctr Virtual Safe & Automated Const, Wuhan 430074",Hubei,Peoples R China
bd253827-996d-49db-94f8-a89ed063ce8b,"Shenzhen Univ, Sino Australia Joint Res Ctr BIM & Smart Construct",Shenzhen 518060,Peoples R China
5c037860-8798-4123-8503-c15d50796a32,"Univ Tun Hussein Onn Malaysia, Fac Tech & Vocat Educ",Parit Raja,Malaysia
ca0f567c-411e-41e1-8e62-52280e5da688,Malaysia Res Inst Vocat Educ & Training MyRIVET,Parit Raja,Malaysia
1ebad9f3-81b0-4766-8b07-52d1a434b08d,"Sichuan Univ, Coll Architecture & Environm",Chengdu 610064,Peoples R China
9634e34e-9d3e-4e3c-8655-427248692e14,"Chongqing Univ, Sch Management Sci & Real Estate",Chongqing 400044,Peoples R China
f875b39b-543c-4e8f-9200-4476b3cdd7c3,"Chinese Acad Agr Sci, Inst Agr Resources & Reg Planning",Beijing 100081,Peoples R China
d56e4426-54dc-4af3-b39f-4117d4801295,"Shenzhen Univ, Coll Civil Engn",Shenzhen 518060,Peoples R China
a3c5a931-76f1-4769-8c2d-882901fa6e53,"Curtin Univ, Sch Elect Engn Comp & Math Sci, Bentley",WA 6102,Australia
137861cf-8d77-410a-97fe-8d3984bcd65e,"Univ Valladolid, Dept Mat Sci & Met Engn Graph Express Engn Cartog, Sch Ind Engn, Paseo Cauce 59",E-47011 Valladolid,Spain
962dfefb-7bd3-4385-8d7c-22c1f797d691,"ETSII Univ Nacl Educ Distancia UNED, Dept Construct & Mfg Engn, C Juan Rosal 12",Madrid 28040,Spain
af1c92e9-8d22-4c60-aad1-b382f15a63d6,"Univ Lisbon, Dept Civil Engn Architecture & Georesources, Inst Super Tecn, Ave Rovisco Pais",P-1049001 Lisbon,Portugal
6d3c7556-a5c3-4d9c-ba4d-4b5e6f01ee40,"Australian Univ, Coll Engn, Dept Civil Engn, Ind Practice",Safat 13015,Kuwait
34ed1213-3668-42a0-a3fa-cab0915102e7,"Kuwait Univ, Coll Architecture, Dept Architecture",Safat 14060,Kuwait
82acd09f-4e15-4308-8ad4-0864121235ed,"Shahjalal Univ Sci & Technol, Dept Civil & Environm Engn",Sylhet 3114,Bangladesh
5da2ba49-fd58-48de-9d31-3a5815b2f2dc,"Helwan Univ, Fac Engn Mataria, Dept Civil Engn",Cairo 11718,Egypt
e347bdbc-9ee7-41d2-ac7e-b107fbc6ccc5,"Bournemouth Univ, Fac Sci & Technol, Comp & Informat",Bournemouth BH12 5BB,England
501cb3de-3393-4903-9ab2-67ddf614cfbe,"VisiLean, One West Point",London W3 6RU,England
2d93e8e5-fb34-4df5-8e7d-1d35bcc27ae3,"Northwest Univ, Coll Chem & Mat Sci, Shaanxi Key Lab Physicoinorgan Chem, Key Lab Synthet & Nat Funct Mol, Minist Educ, Xian 710127",Shaanxi,Peoples R China
7843159f-4c54-4e96-9501-f499615e3590,"Univ Auckland, Sch Comp Sci",Auckland 1010,New Zealand
cc9cd5b2-fa2c-452e-9c36-994934831901,Codify Asset Solut Ltd CAS,Auckland 1010,New Zealand
5fef3e95-a446-4603-b50a-3dbc08f8c3ae,"Univ Adelaide, Sch Architecture & Civil Engn, Adelaide",SA 5005,Australia
15abc42a-0897-461e-830f-088d53a198d5,"Pontificia Univ Catolica Chile, Fac Engn, Sch Civil Construct, Macul 7810000",Santiago,Chile
9d103b4f-cb11-47ab-86c8-35acb3e6d24f,"Liaoning Tech Univ, Sch Business Adm",Fuxin 125105,Peoples R China
19f1a7df-5ac2-454f-87bf-a1b04eeb0a7a,"Univ Teknol MARA, Sch Civil Engn, Cawangan Pulau Pinang",Pulau Pinang,Malaysia
db539f4f-58b3-4492-baac-c52e5e1f6616,"Univ Teknol MARA, Sch Civil Engn, Shah Alam",Selangor,Malaysia
e158a9ea-660a-4e9a-aa05-50ba81185a30,"Sakarya Univ Appl Sci, Dept Civil Engn",TR-54050 Sakarya,Turkey
bf6caec4-527f-4bb6-8330-be6597039120,"Bogazici Univ, Dept Civil Engn",TR-34342 Istanbul,Turkey
d1646657-4afd-4e49-aa4c-cd1b52149920,"Cardiff Univ, Sch Engn, 52 Parade",Cardiff CF24 3AB,Wales
37116f5c-9a8e-4622-abf3-556649445d58,"Najran Univ, Fac Engn, Dept Civil Engn",Najran 66241,Saudi Arabia
a8272a1f-d2d4-4738-bca6-5f89b56a6626,Luxembourg Inst Sci & Technol,L-1009 Luxembourg,Luxembourg
9f5d1195-c951-4c94-beb3-66579f2a0b11,"Univ Cape Town, Dept Construct Econ & Management, Fac Engn & Built Environm, Level 5, Snape Bldg, Upper Campus",ZA-7701 Cape Town,South Africa
205b6698-1f50-42c3-9649-777c4ad72b88,IME Inst Mil Engn,BR-22290270 Rio De Janeiro,Brazil
02bf9f3a-0e02-41c8-821b-1b17b41b7e87,"Zhejiang Sci Tech Univ, Sch Civil Engn & Architecture",Hangzhou,Peoples R China
e35b2e9e-a486-4dd2-904a-0cf26c94ea7e,"North China Inst Sci & Technol, Sch Civil Engn & Architecture",Langfang,Peoples R China
d512476c-07df-44a3-a027-0f81252cd378,"Politecn Milan, Dept Architecture Built Environm & Construct Engn, Via Ponzio 31",I-20133 Milan,Italy
690edf58-6aa0-4947-8363-f764b78c6699,"Hanbat Natl Univ, Dept Architectural Engn, 125 Dongseo Daero, S8-321",Daejeon 34158,South Korea
bf09a2fb-ec80-4b96-8ecf-90b6072ad9f7,"Max Delbruck Ctr Mol Med, Helmholtz Assoc",D-13125 Berlin,Germany
cebbbb79-cc7c-4013-83e4-0707c2b6c80b,"Harvard Med Sch, Childrens Hosp, Program Cellular & Mol Med, Boston, MA 02115 USA; Harvard Med Sch, Immune Dis Inst, Boston",MA,United States
48671ced-f579-4345-8913-47f2cd950985,"Med Univ Innsbruck, Bioctr, Div Dev Immunol",A-6020 Innsbruck,Austria
602a8a8f-6d86-430c-9cf3-4bb3165d2111,"Max Delbruck Ctr Mol Med, Helmholtz Assoc, Berlin Inst Med Syst Biol, D-13125 Berlin, Germany; Univ Innsbruck, Inst Biomed Ageing Res",A-6020 Innsbruck,Austria
0e4e6d0d-515f-44bb-8949-adfa1bc9e58c,"Eberhard Karls Univ Tubingen, Inst Pathol & Neuropathol",D-72076 Tubingen,Germany
e5d0c712-38cf-49ad-ba1c-56e67fd82a53,"Eberhard Karls Univ Tubingen, Comprehens Canc Ctr Tubingen, D-72076 Tubingen, Germany; Beijing IDMO Co Ltd, Beijing 100000, Peoples R China; Charite, Dept Pediat, D-13353 Berlin, Germany; Broad Inst MIT & Harvard, Cambridge, MA 02142 USA; CRISPR Therapeut, Cambridge",MA,United States
baf36a37-b1e9-4d12-b61e-2a26e840b19a,"Univ South Australia, UniSA STEM, Mawson Lakes",SA 5095,Australia
18e609b6-c4a0-4e20-ae17-65c13612ef7e,"Univ East London, Sch Architecture Comp & Engn",London E16 2RD,England
b51b66e9-e75e-4d03-9c86-2c4c2568f665,"Univ West, Dept Engn Sci",Trollhattan,Sweden
f1157a53-cfea-41b7-8771-7ca4a0f6785e,"Al Ahliyya Amman Univ, Dept Civil Engn",Amman,Jordan
28ef4fda-8a6c-43cd-832b-7975b3ab2e78,China Acad Bldg Res,Beijing 100190,Peoples R China
bb047d3b-9e99-46fe-911c-5fad119c2f05,"Tsinghua Univ, Sch Architecture",Beijing 100190,Peoples R China
54488f72-8f6b-4a07-aa78-52a20c8821e5,"Heilongjiang Univ Sci & Technol, Sch Publ Adm",Harbin 150006,Peoples R China
4fed397f-1073-4e31-89ad-bf3309d191d7,"Concordia Univ, Ctr Innovat Construct & Infrastruct Engn & Manage, Montreal",PQ,Canada
b7f9f4a1-2ab7-4ffc-a04e-5a8d5299be8c,"Chungbuk Natl Univ, Dept Civil Engn",Cheongju 28644,South Korea
053719ce-4c46-4e8f-a49e-06956fc58019,"Korean Railroad Res Inst, Adv Railroad Civil Engn Div",Uiwang 16105,South Korea
f988260a-4bdf-464b-bd7d-93f375e3ad89,"Purdue Univ, Automat & Intelligent Construct AutoIC Lab, Sch Construct Management Technol, 401 N Grant St, W Lafayette",IN,United States
bc786ea6-904e-4db9-b127-29a38fc062dc,"Texas A&M Univ, Dept Construct Sci, 3137 TAMU, College Stn",TX,United States
d557d129-64d0-4566-b968-4668b8629f91,"Microdesk Inc, 150 Calif St, Suite 1150, San Francisco",CA,United States
a7bdf982-b1e6-441a-aa96-d1f2e95a931f,"Taylors Univ, Fac Innovat & Technol, Sch Architecture Bldg & Design, Subang Jaya 47500",Selangor,Malaysia
68e4c84a-e913-49ef-b19c-a6de6a222c4b,"Univ Teknol Malaysia, Inst Smart Infrastructure & Innovat Construct, Construct Res Ctr, Skudai 81310",Johor,Malaysia
eaa11932-bf30-4ed6-922a-79b415228ffa,"Nanjing Audit Univ, Sch Engn Audit",Nanjing 211815,Peoples R China
e4a70f71-01d8-4937-b11f-2365ec3539d8,"Univ Malaysia Pahang Al Sultan Abdullah, Fac Ind Management, Kuantan 26300",Pahang,Malaysia
4188193a-58d3-4167-957e-ab5969d4abde,"Swinburne Univ Technol, Fac Engn Comp & Sci, Sarawak Campus, Kuching 93350",Sarawak,Malaysia
8e2a6a5e-0989-4c7f-8ec0-4ec3b1c3e0ab,"Tamkang Univ, Dept Civil Engn",New Taipei City 251,Taiwan
fb1a9b97-06fc-4104-b1a2-da409f2917fc,"Tamkang Univ, Res Dev Ctr Construct Law",New Taipei City 251,Taiwan
9e42a5be-1e71-4e52-a901-20a5985effe2,"Xiamen Univ, Sch Architecture & Civil Engn",Xiamen 361005,Peoples R China
34811ab1-b2d9-4684-80f7-d4904b239df0,"Manchester Metropolitan Univ, Sch Engn, Manchester M15 6BH",Lancs,England
864a92b5-bdf5-47f1-8988-3525ebb7e0c9,"KEF Holdings, Dubai Int Financial Ctr DIFC",Dubai,United Arab Emirates
d7d5d3a7-150c-45af-b801-145b96f9d3a2,"Univ Malaya, Ctr Bldg Construct & Trop Architecture BuCTA, Fac Built Environm",Kuala Lumpur 50603,Malaysia
126e575b-456a-44c8-8f09-0bdd6134e0de,"Univ Lisbon, Inst Super Tecn, CERIS, Ave Rovisco Pais 1",P-1049001 Lisbon,Portugal
4c738d2c-7c4c-49a0-aaf4-5fbfb1599bfe,"BESIX, Ave Communautes 100",B-1200 Brussels,Belgium
c10fff20-3cb5-4431-9ca7-8a064fa096fb,"UCL, Civil Environm & Geomatic Engn Dept",London WC1E 6BT,England
57ae4f3c-e73c-452a-894b-9611ae2056b4,AtkinsRealis,Swindon SN11DW,England
aee2c539-0f72-41d1-b725-4dc39410e5db,"Univ Trento, Dept Ind Engn",I-38123 Trento,Italy
e1032539-c3fa-4eb3-b8d5-7a001950301e,"Wuhan Inst Technol, Sch Civil Engn & Architecture",Wuhan 430074,Peoples R China
4640c65e-04a0-44a3-8480-b8f16cc02745,China MCC5 Grp Corp Ltd,Chengdu 610056,Peoples R China
52d19f36-57e6-4d4e-8803-e5f5a5588680,"Univ Malaysia Pahang Al Sultan Abdullah, Fac Ind Management",Kuantan 26300,Malaysia
0dd0cb91-66a9-44a2-b299-14877645cbc5,"Univ Minho, ISISE Inst Sci & Innovat Biosustainabil IB S, Sch Engn, Civil Engn Dept",Guimaraes,Portugal
a15e431b-165e-4c26-9dec-53d985c7b29c,"Univ Teknol MARA, Malaysia Inst Transport MITRANS, Shah Alam 40450",Selangor,Malaysia
7ab2bcab-f03c-4248-b803-41fe2fbb90b9,"Univ Teknol MARA UiTM Cawangan Selangor, Fac Business & Management, Kampus Puncak Alam, Bandar Puncak Alam 42300",Selangor,Malaysia
aaa5dd5b-654c-4bcd-b3fd-3444c977f7a1,"Univ Porto, Civil Engn",Porto,Portugal
022e89d8-6f41-42be-a40c-3e642cb2bdf2,"Univ Porto, Fac Engn, PROA LAETA",Porto,Portugal
9400f8f0-6644-480e-9481-6b4241250742,"Vilnius Gediminas Tech Univ, Fac Civil Engn, Dept Construct Management & Real Estate",Vilnius,Lithuania
1fd0ffd5-0640-4ce1-9fbe-44319734c4fd,"Vilnius Gediminas Tech Univ, Fac Environm Engn, Dept Rd",Vilnius,Lithuania
6b3e62af-4f42-4d58-8a6d-f7863464212e,"Vilnius Gediminas Tech Univ, Fac Fundamental Sci, Dept Engn Graph",Vilnius,Lithuania
97a1e993-d34c-4059-aac9-6fcc95d2423d,"Zagazig Univ, Fac Engn, Dept Construct Engn & Util",Zagazig,Egypt
b11b5c69-4fe2-4896-9cff-ac830140545f,"Univ Canberra, Bruce",ACT 2601,Australia
1431e2be-3b98-4134-a567-2421d5534ae8,"Deakin Univ, Geelong",Vic 3220,Australia
1140480b-8d9f-432c-bdb7-f47c5ad01008,"Publ Works Dept Malaysia, Bldg Informat Modelling BIM & Preapproved Plan PAP, Architects Branch",Kuala Lumpur 50350,Malaysia
90596252-a3f1-42e0-8b12-220bea0fe271,"Univ Teknol PETRONAS, Fac Engn, Dept Civil & Environm Engn",Bandar Seri Iskandar 32610,Malaysia
e6f190ee-8996-4aa7-ba99-12c2c75c9234,"Univ Teknol Malaysia, Fac Built Environm & Surveying, Dept Quant Surveying",Johor Baharu 81300,Malaysia
07374856-f4a8-4018-8e07-e62fea146a7c,"Kanazawa Univ, Canc Res Inst, Div Med Oncol, Kanazawa",Ishikawa,Japan
f2dd04cf-0117-43d6-b21d-4c21d4a24daf,"Kanazawa Univ, Nano Life Sci Inst, Kanazawa",Ishikawa,Japan
af445a5d-e05f-412a-90a0-cf20fa0771ee,"Nagoya Univ, Dept Resp Med, Grad Sch Med, Nagoya",Aichi,Japan
85a6b191-f133-4d70-ad29-de2b54c4135a,"Nagoya Univ Hosp, Dept Adv Med, Nagoya",Aichi,Japan
b34495f4-f18b-40a8-98e9-3a9b39f55dfe,"Inst Biomed Res & Innovat, Div Integrated Oncol, Kobe",Hyogo,Japan
69aeedb3-e6d4-481a-af5e-bceada323ccd,"Kobe Minimally Invas Canc Ctr, Dept Med Oncol, Kobe",Hyogo,Japan
902bbc68-cd52-4683-a692-7485c251e0c4,"Shizuoka Canc Ctr, Div Thorac Oncol",Shizuoka,Japan
2e37fdb3-42ee-40c4-86cc-e64a10e172eb,"Kanazawa Univ Hosp, Innovat Clin Res Ctr iCREK, Kanazawa",Ishikawa,Japan
fc8d4e10-1e3a-4be7-8b15-ca7a35603867,"Hiroshima Univ Hosp, Dept Data Sci, Ctr Integrated Med Res",Hiroshima,Japan
eb483d30-e379-4644-b3ca-69ba54ba359c,"Chiba Univ Hosp, Clin Res Ctr",Chiba,Japan
74ecf279-9f3a-4947-b23f-7fd790772e71,"Takarazuka City Hosp, Dept Med Oncol, Takarazuka",Hyogo,Japan
d7d47e5d-ec85-4481-aebd-88efc876fe65,"Natl Hosp Org Nagoya Med Ctr, Nagoya",Aichi,Japan
43ef0bd1-e71c-49df-b89e-6c5e27bd974b,"Duke NUS Med Sch, Canc & Stem Cell Biol Signature Res Program",Singapore,Singapore
c44eef3a-163c-44d0-8dec-d3fb23c89f22,"Singapore Gen Hosp, Dept Haematol",Singapore,Singapore
82dd1844-dbc4-4f75-a41c-ca83b093fcb9,"Natl Canc Ctr Singapore, Dept Med Oncol",Singapore,Singapore
88677619-8e8c-4217-acff-f1d0bd2da209,"Duke Univ, Med Ctr, Dept Med, Durham",NC,United States
3029ddbd-45bc-4d9c-8e18-cdf3ba83b4c8,"Univ Florida, ME Rinker Sr Sch Construct Management, 573 Newell Dr, Gainesville",FL,United States
1ff4af81-eb15-4cff-b111-9a691daad71b,"Penn State Univ, Dept Architectural Engn, 104 Engn Unit A, University Pk",PA,United States
509fda4b-6d44-454b-b8fa-3ed6130bc6a7,"Univ Greenwich, Dept Built Environm",London SE10 9LS,England
45ae517b-76c8-456c-b961-c1d24b0f7d82,"Univ Liverpool, Sch Architecture",Liverpool L69 7ZN,England
e83cd4b3-3b1a-4f72-9316-f509a414aac5,"South China Normal Univ, Coll Biophoton, MOE Key Lab Laser Life Sci",Guangzhou 510631,Peoples R China
89f9b821-28ad-4ded-ba9e-79432eabbc0b,"South China Normal Univ, Coll Biophoton, Guangdong Prov Key Lab Laser Life Sci",Guangzhou 510631,Peoples R China
67a2241d-2547-4a55-aa66-35d22485d07d,"Jinan Univ, Dept Pain Management, Affiliated Hosp 1",Guangzhou 510632,Peoples R China
96e9d9b2-6c9f-4b14-ba71-4d764283ff2b,"South China Normal Univ, SCNU Qingyuan Inst Sci & Technol Innovat Co Ltd",Qingyuan 511500,Peoples R China
e691d996-5c94-483b-8659-ee33df474bec,"Deakin Univ, Ctr Res Assessment & Digital Learning CRADLE, Geelong",Vic,Australia
35a39ec5-a21b-40cf-a108-61be9d5c572b,"Birmingham City Univ, Fac Comp Engn & Built Environm, City Ctr Campus, Birmingham B4 7XG",W Midlands,England
d1151e1d-f9ef-4596-a9b7-c4979b523399,"Univ Nacl La Plata, Fac Informat, Ctr Invest LIFIA, Calle 50 Y 120, RA-1900 La Plata",Buenos Aires,Argentina
9ac80038-daa9-4300-91bd-4bd1380094be,"Consejo Nacl Invest Cient & Tecn CONICET, Godoy Cruz 2290, C1425FQB, Godoy Cruz",Buenos Aires,Argentina
70b2922d-eb72-40a3-bec7-db9f49cc623b,"Guangzhou Univ, Sch Comp Sci & Cyber Engn, Guangzhou 510006",Guangdong,Peoples R China
1a8f5f54-81be-4350-afe7-4f0635bb717a,"Guangzhou Univ, Guangdong Prov Key Lab Bldg Energy Efficiency & A, Guangzhou 510006",Guangdong,Peoples R China
60f1014e-02e8-4d4e-b92a-5f18b805c0b0,"Guangzhou Univ, APOL Internationl & Associates Grp Guanzhou Branc, Inst Bldg Informat Modeling, Guangzhou 510006",Guangdong,Peoples R China
65c2fc84-3c6a-4a68-b08a-c214dcbca412,"Sun Yat Sen Univ, Sch Software Engn",Zhuhai 519082,Peoples R China
1794f9a9-2dea-4f9d-8857-e7239b0fb608,"Univ Aizu, Grad Sch Comp Sci & Engn, Aizu Wakamatsu",Fukushima 9658580,Japan
bc35aaa6-820b-41f9-a3fe-1442bdb06577,"Guangzhou Univ, Sch Civil Engn, Guangzhou 510006",Guangdong,Peoples R China
620bbf33-a97d-40e3-bf33-0435d6276ff2,"Auckland Univ Technol, Sch Engn Comp & Math Sci, Dept Built Environm Engn, 34 St Paul St",Auckland 1142,New Zealand
57fd4673-5006-40a9-8309-9b9156092a21,"Heriot Watt Univ, Sch Energy Geosci Infrastruct & Soc EGIS",Putrajaya,Malaysia
3ee04506-e122-48ba-8f93-b306f6cbe902,"NED Univ Engn & Technol NEDUET Karachi, Dept Civil Engn, Karachi",Sindh,Pakistan
ab3d22be-a200-40f1-b99e-d055c2daeb50,"Incheon Natl Univ, Urban Sci Inst",Incheon 22012,South Korea
9a13e711-d131-4fcf-b455-a585370aa6bd,"Tallinn Univ Technol, Dept Civil Engn & Architecture",EE-12616 Tallinn,Estonia
08447749-a8ce-4be9-b3ac-d184ab65a52f,"Univ Bologna, Dept Architecture",I-40126 Bologna,Italy
a4922bce-5df2-446a-964c-05f2aff5e23b,"Tampere Univ, Dept Construct Management & Econ",Tampere 33720,Finland
3c8638f8-841a-449a-b26e-3c9502d26221,"Natl Taiwan Univ, Dept Civil Engn",Taipei,Taiwan
e3079248-f713-4d3b-8539-52433beb88a4,"Doosan Infracore, Heavy Dev Elect & Elect Cntr, 489 Hwasu Dong",Incheon 22502,South Korea
15da1d42-797b-44e0-b0dd-2547d3fa84a1,"Hanyang Univ, Dept Civil & Environm Engn",Seoul 04763,South Korea
1a887113-bc38-4cee-8f07-58cafb6f6ce6,"Procon Consulting, BIM Program, Arlington",VA,United States
b48b784c-58b6-47ae-8284-967949ee6ae3,"Procon Consulting, Arlington",VA,United States
1a9c80ea-3dca-4fcf-9334-f99211f2067b,"Univ Colorado, Construct Engn & Management, Denver",CO,United States
1c1ba29d-fdda-46cf-9544-620f3f9fd498,"Prairie View A&M Univ, Sch Architecture, Dept Construct Sci, Prairie View",TX,United States
52b7441c-df81-4564-acde-afb6ac40f961,"Shahid Beheshti Univ, Fac Architecture & Urban Planning",Tehran 1983969411,Iran
96170388-fc28-4a6c-b63c-7d89d31a26c6,"Nanjing Univ Sci & Technol, Sch Environm & Biol Engn",Nanjing 210094,Peoples R China
422e3f53-7f0b-468d-bbab-45957ab12cb9,"Shenzhen Univ, Hlth Sci Ctr, Sch Biomed Engn",Shenzhen 518060,Peoples R China
7b90ddc9-fa0f-44a1-9cc0-231bd3cfe360,"Ben Gurion Univ Negev, Avram & Stella Goldstein Goren Dept Biotechnol Eng",IL-84105 Beer Sheva,Israel
87e62b39-abd8-4afe-9d64-569ee74c37b9,"Univ Grenoble Alpes, CNRS, DCM UMR 5250",F-38000 Grenoble,France
70170684-3884-4d03-b1b9-652ced899adb,"Silesian Tech Univ, Ctr Organ & Nanohybrid Elect",PL-44100 Gliwice,Poland
63ee1124-4f43-475a-babe-509652614eb0,"Silesian Tech Univ, Dept Phys Chem & Technol Polymers",PL-44100 Gliwice,Poland
6340ae80-1719-4546-a0dd-511988a1b41b,"Tamkang Univ, Res Dev Ctr Construct Law, New Taipei",Taipei County,Taiwan
59905fce-ae67-4053-a54b-45fa2c3f0955,"Tamkang Univ, Dept Civil Engn, New Taipei",Taipei County,Taiwan
443cf5c5-b7c5-4519-99e2-a712cfd81846,"Univ Politecn Madrid, Dept Ingn Civil, Construcc, ETS Ingn Caminos Canales & Puertos",E-28040 Madrid,Spain
57709140-cad6-42cb-a9e6-ba691cd382c1,"Univ Politecn Madrid, Dept Ingn & Morfol Terreno, ETS Ingn Caminos Canales & Puertos",E-28040 Madrid,Spain
169a80cf-f0ee-4e36-8930-54675073e610,"Natl Univ Sci & Technol, Dept Construct Engn & Management, Sch Civil & Environm Engn",Islamabad,Pakistan
503ae61a-db4e-4851-8bd7-5cd112aa4f6c,"Natl Taiwan Univ, Dept Civil Engn, 1, Sec 4, Roosevelt Rd",Taipei 106319,Taiwan
37708deb-6fd7-4c24-a02e-caa164a78594,"Hanoi Univ Civil Engn, 55 Giai Phong St",Hanoi 11616,Vietnam
1f1ca458-7b0a-44bd-91bd-7670c5ea8353,"Guangxi Med Univ, Dept Med Oncol, Affiliated Hosp 2, 166 Daxuedonglu Rd, Nanning 530007",Guangxi,Peoples R China
9d6d3d59-3011-4572-8b23-106f531af359,"Hanyang Univ, Div Smart Convergence Engn, Major Architecture IT Convergence Engn",Ansan,South Korea
37eb12d2-a942-4d93-b694-1000bf2b47e3,"Natl Univ Singapore, Dept Bldg, 4 Architecture Dr",Singapore 117566,Singapore
