affiliation_id,institution_name,city,country
61b62d6b-b9fe-43aa-b6e4-86b61ba1ad9f,"Xian Jiaotong Liverpool Univ, Dept Civil Engn",Suzhou 215123,Peoples R China
2043c94a-6a3e-44ee-ac4e-919fdf677d63,"Univ Liverpool, Dept Civil Engn & Ind Design",Liverpool L69 3BX,England
e9249532-eba3-40fa-95d4-83123ec52be4,"Chongqing Univ, Sch Civil Engn",Chongqing 400045,Peoples R China
c2d8e624-0528-463a-b71f-4cbbb7efc87b,"Chongqing Univ, Minist Educ, Key Lab New Technol Construct Cities Mt Area",Chongqing 400045,Peoples R China
a6f91042-f16a-4308-bd52-a276ab227f0a,"Victoria Univ, Coll Sport Hlth & Engn, Melbourne",Vic 3011,Australia
08380a5d-1f6c-4670-a7c7-6eb638690bfc,"Chongqing Univ, Corresponding Inst 1, Sch Civil Engn",Chongqing,Peoples R China
797298fe-0dcf-40eb-af2c-707e17e36918,"King Saud Univ, Coll Architecture & Planning, Dept Architecture & Bldg Sci",Riyadh 11574,Saudi Arabia
34db407e-348b-4cb8-b9b9-8edf387db530,"Hong Kong Polytech Univ, Dept Bldg & Real Estate",Hong Kong,Peoples R China
0e37dc51-d1f5-4de7-907a-97403d50e80b,"British Univ Egypt BUE, Fac Engn, Dept Civil Engn",El Sherouk 11837,Egypt
c2b6b3bd-99ea-492a-8744-4ddc1e6e5be6,"Gen Petr Co GPC, POB 743",Cairo,Egypt
cfe692ef-97e2-4ab1-9454-7cc2f8c9a4ed,"Najran Univ, Coll Engn, Architectural Engn Dept",Najran,Saudi Arabia
46e22a61-c55d-46d9-a5ef-8d750f6f0eb7,"Univ Teknol PETRONAS, Dept Civil & Environm Engn, Tronoh 32610",Perak,Malaysia
a5f5f115-8c20-4413-8d28-9f5a3b8c52cd,"Transilvania Univ Brasov, Fac Civil Engn, Turnului 5",Braspv 500152,Romania
7155947e-7395-4203-92b1-05c9cff89843,"Najran Univ, Coll Engn, Dept Civil Engn",Najran,Saudi Arabia
30b0a03a-6b70-4e40-b0b0-fec0b3000883,"Taif Univ, Coll Engn, Dept Civil Engn, POB 11099",Taif City 21974,Saudi Arabia
ff5d53e6-9ec3-4c26-b797-02816876d998,"Concordia Univ, Dept Bldg Civil & Environm Engn, Complecc Lab, Montreal",PQ,Canada
7e303f56-640c-46ca-a6d3-676baf1b1f3f,"Deakin Univ, Sch Architecture & Built Environm, Geelong",Vic 3220,Australia
60e1194a-f217-459f-87d4-7b5f4c9a6997,"Univ Melbourne, Fac Architecture Bldg & Planning, Parkville",Vic 3010,Australia
e9fb5f63-2e57-4b32-ae62-21f734e17623,"Birmingham City Univ, Fac Comp Engn & Built Environm",Birmingham B4 7XG,England
d3e02806-21a5-4966-9087-884ae403ce0d,"Dalian Maritime Univ, Dept Civil Engn",Dalian 116026,Peoples R China
27542b76-6024-4617-9911-0df79283a4ad,"Cardiff Univ, Cardiff Sch Engn",Cardiff CF24 3AA,Wales
3d0c04a9-24a6-47c8-ab28-2b0c8332a3d6,"Cracow Univ Technol, Fac Civil Engn, Div Management Civil Engn",PL-31155 Krakow,Poland
d5f9155b-44d1-4bda-93f6-72dc9b09d4a3,"Univ Manchester, Dept Mech Aerosp & Civil Engn, Manchester",Lancs,England
5265f2e4-6fa8-40a7-8b5e-c456e39c9bfc,"Aston Univ, Dept Civil Engn, Birmingham",W Midlands,England
8e188223-2f38-40b0-bda5-89c7c64f92fe,"Univ Nottingham, Dept Civil Engn",Nottingham,England
241ebcd8-9cbc-4619-8d67-1ccf8719c679,"Univ West England, Sch Architecture & Environm, Bristol",Avon,England
3de42f33-ee96-4d0c-84f3-af1114b1e3d2,"Wuhan Univ, Sch Civil Engn",Wuhan 430072,Peoples R China
10f48c8b-9d97-44be-8082-fb0d09c77420,"City Univ Hong Kong, Dept Adv Design & Syst Engn",Hong Kong,Peoples R China
088a9cc9-51cb-47d2-9e4a-d55fe45bb80e,"City Univ Hong Kong, Shenzhen Res Inst",Shenzhen,Peoples R China
cf87465d-e1bc-4129-916a-becf06873fa2,"Hong Kong Polytech Univ, Dept Bldg & Real Estate, Kowloon, Hung Hom, 11 Yuk Choi Rd",Hong Kong,Peoples R China
5b2c3990-eb1e-4499-8a50-a4f5a2a3c936,"Wuhan Univ, Econ & Management Sch",Wuhan 430072,Peoples R China
648b9e66-7b72-49f5-ac40-c65f54be3a70,"Univ Alberta, Dept Elect & Comp Engn, Edmonton",AB T6G 2R3,Canada
63644231-74aa-4348-bc7b-51bf2b785935,"Polish Acad Sci, Syst Res Inst",PL-00901 Warsaw,Poland
dbcd5b9b-630e-4503-8e1b-6fb445bca407,"King Abdulaziz Univ, Fac Engn, Dept Elect & Comp Engn",Jeddah 21589,Saudi Arabia
3e936df6-45b9-4772-9c07-30b36d3fd3dd,"Istinye Univ, Fac Engn & Nat Sci, Dept Comp Engn",Sariyer Istanbul,Turkey
7aeddd84-aac2-4d47-87c2-5bca831d5ef7,Changsha Univ Sci & Technol,Changsha,Peoples R China
12ae9096-353f-421f-8525-8070fc0488af,Changsha BIM Cloud Informat Technol Co Ltd,Changsha,Peoples R China
0301a874-5f9c-4dd7-b030-93d77e5bc7e6,Hunan Expressway Grp Co Ltd,Changsha,Peoples R China
27e567ba-7c21-4982-9ba0-c007a6604e0b,JiangXi Ganyue Expressway Engn Co Ltd,Nanchang,Peoples R China
e1a2ef23-3cfb-42b2-94ce-6ff49e881f7a,"Birmingham City Univ, Coll Built Environm, Fac Comp Engn & Built Environm CEBE",Birmingham B5 5JU,England
484e8da5-b53c-490f-bb26-56a0a2bf6d58,Zigurat Global Inst Technol,Barcelona 08018,Spain
5c573042-6c26-4696-8362-2616be48e791,Willmott Dixon Interiors,Birmingham B4 6GH,England
cc439904-a743-43dd-88b2-2fce041905df,"Queens Univ Belfast, Sch Nat & Built Environm",Belfast BT7 1NN,Northern Ireland
fd7a246f-7687-471d-993a-39a827378969,"Univ Teknol PETRONAS, Dept Civil & Environm Engn, Seri Iskandar 32610",Perak Darul Rid,Malaysia
28e13322-c2b5-497e-9ab5-8f2652757bf1,"Amer Univ Middle East, Coll Engn & Technol",Egaila 54200,Kuwait
49792d09-c10b-40d3-92e6-e48c7853af0f,"Univ Cambridge, Inst Mfg",Cambridge,England
4d2e0742-56ea-4392-9038-a454f40e09ea,"Pamukkale Univ, Comp Engn Dept",Denizli,Turkey
cb0438a3-2749-4ece-b95c-53e295d3f2ee,"Middle East Tech Univ, Dept Civil Engn",Ankara,Turkey
6c91ae95-c863-40fd-9c68-9ca07122de98,"Izmir Inst Technol, Dept Comp Engn",Izmir,Turkey
6c3e7dd8-c589-4a1a-a355-e1ef22f54e8b,"Warsaw Univ Technol, Fac Geodesy & Cartog, Dept Spatial Planning & Environm Sci",Warsaw,Poland
5d1974b0-825f-4d71-9246-a2867d2769a1,"Warsaw Univ Technol, Fac Geodesy & Cartog, Plac Politech 1",PL-00661 Warsaw,Poland
e349c323-5e49-4520-85a4-f7f7b6c6f35e,"SXD Poland Ltd, Aleje Jerozolimskie 65-70-03-168",PL-00697 Warsaw,Poland
80eb2e72-9e60-4055-95f6-5113d9c76103,"Dalian Univ Technol, Dept Construct Management",Dalian,Peoples R China
414117ee-66a0-4c19-87d9-7763a347829e,"Univ Manchester, Sch Mech Aerosp & Civil Engn, Manchester M13 9PL",Lancs,England
9fba02ed-ff30-4839-8fcb-387adf51b899,"Suzhou Univ Sci & Technol, Dept Construction Management",Suzhou 215011,Peoples R China
de5e2346-8c28-4a3e-8e6a-d0374625c512,"City Univ Hong Kong, Dept Architecture & Civil Engn",Hong Kong 999077,Peoples R China
5360a7f1-d5da-4ec6-9a64-b12ee8533957,"Delft Univ Technol, Fac Civil Engn & Geosci",NL-2628 CN Delft,Netherlands
ed7733bf-83bf-419b-adce-9a127f76bcd9,"Nanjing Univ, Sch Management & Engn",Nanjing 210093,Peoples R China
8f01c720-ed23-4368-95d7-e995ab1388dc,"Loughborough Univ, Sch Architecture Civil & Bldg Engn, Loughborough LE11 3TU",Leics,England
30de15c8-a340-4081-baba-73b0001ec2ce,"UCL, Bartlett Sch Sustainable Construct",London WC1E 7HB,England
36b660ae-894c-4a36-ab0e-6eed8996ab3e,"Woosong Univ, Dept Railrd Construct Syst Engn",Daejeon 34606,South Korea
e36378bb-d626-4e2c-b88e-a714af88a18f,"Hanyang Univ, Sch Architecture & Architectural Engn, ERICA Campus",Ansan 15588,South Korea
160b4c26-9724-430b-a93f-d8a863b52689,"Northumbria Univ, Fac Engn & Environm",Newcastle Upon Tyne NE1 8ST,England
2480c320-d72e-4608-a843-9a0cc4dd2553,Ho Chi Minh City Univ Transport,Ho Chi Minh City,Vietnam
986032e8-a0b8-4a93-ae90-8683b4b31129,"DEOCA Res & Training Inst, DEOCA Grp",Ho Chi Minh City,Vietnam
8815e023-cc87-4057-b231-439f1142ff9f,"Warsaw Univ Technol, Fac Geodesy & Cartog",Warsaw,Poland
75d1a995-d17a-438a-a0de-23a8ba0a49b9,"Imam Khomeini Int Univ IKIU, Dept Civil Engn",Qazvin,Iran
7515449e-4b52-42c4-bcb2-6eb319a73290,"Pontif Catholic Univ Peru, Dept Engn",Lima 15088,Peru
a542a9f1-e33a-4acf-b4cb-2bdcf3d5a0c8,"Loughborough Univ, Sch Architecture Bldg & Civil Engn, Bldg Informat Management",Loughborough LE11 3TU,England
af892435-4ce6-421e-bda2-586beec342fa,"Loughborough Univ, Sch Architecture Bldg & Civil Engn, Construct Management",Loughborough LE11 3TU,England
53447d2e-8313-45bc-a673-117887b83185,"Univ Malaya, Fac Built Environm",Kuala Lumpur 50603,Malaysia
b1807ec4-cd45-4461-960f-171b19d040b1,"Jining Univ, Confucian Sch Business",Qufu 273155,Peoples R China
59fff7ff-89d0-492d-a83d-2f4215878329,"Univ Yasuj, Dept Tech & Engn",Yasuj,Iran
9f927f2b-d544-47f6-aa25-8a98426fe5cf,"Islamic Azad Univ, Dept Architecture & Urban Design, Yasooj Branch",Yasuj,Iran
1eb01a25-9ca5-4b52-98a6-0d83554390a3,"Victoria Univ Wellington, Wellington Sch Architecture, POB 600",Wellington 6140,New Zealand
125aa230-b619-472b-842a-9b9e86c72125,"Dollasoft Technol, Dollahills Res Lab",Lagos,Nigeria
b27a9ad2-6c54-4973-b715-447dce84d9a9,"Univ Teknol PETRONAS, Dept Civil & Environm Engn, Seri Iskandar 32610",Perak,Malaysia
87a540e2-1290-4328-8fa6-ab0fbea8ee60,"Univ South Australia, Scarce Resources & Circular Econ ScaRCE, UniSA STEM, Adelaide",SA,Australia
9c383426-3705-4738-a1ca-0af21087d2b4,"Birmingham City Univ, Dept Built Environm, Birmingham",W Midlands,England
8fc9678f-fccb-4648-9c31-10ce58d6cc98,"Univ Johannesburg, Fac Engn & Built Environm",Johannesburg,South Africa
9a205553-bf6b-4bf6-b6b9-0ec43eff2b4d,"NICMAR Univ, Sch Construct",Pune,India
d1d86f5e-4d1a-441f-a0b3-5adeb244b683,"Sichuan Univ, Coll Architecture & Environm, 24 First Sect, South First Ring Rd",Chengdu 610065,Peoples R China
4d40b411-7bc2-45c3-8ffa-a023956d848a,"Sichuan Kaiyuan Engn Project Management Consulting, 233 Jiaozi Ave",Chengdu 610095,Peoples R China
7e94f0ed-bead-45c7-83b7-eafbe34d3e27,"Univ Adelaide, Sch Architecture & Built Environm, Adelaide",SA 5005,Australia
ea76d2ff-4bfb-425c-8c05-5560df564967,"Incheon Natl Univ, Div Architecture & Urban Design",Incheon 22012,South Korea
5bada72b-b234-4968-9ac3-bdc91059d1bb,"Seoul Natl Univ Sci & Technol, Dept Civil Engn",Seoul 01811,South Korea
da5f0d62-44a9-4943-9d06-c80d388ed9aa,"RMIT Univ, Sch Property Construct & Project Management, Melbourne",Vic 3000,Australia
fddc8c67-9a8b-44dd-95a8-311a6add2cbc,"RMIT Univ, Sch Accounting Informat Syst & Supply Chain, Melbourne",Vic 3000,Australia
7e4fb492-fc89-4f68-b9b7-a74659b1745d,"La Trobe Univ, La Trobe Business Sch, Melbourne",Vic 3086,Australia
c480bf72-a9c7-4194-9f6c-069a0cb0de92,"Queensland Univ Technol, Sch Civil Engn & Built Environm, Brisbane",Qld 4000,Australia
ac7115d8-9b79-4e5d-80fd-f3cd4319f677,"Islamic Azad Univ, Dept Construct Management, Tabriz Branch",Tabriz 5157944533,Iran
4bfb4f94-9b4c-4081-8a41-302d337cadb1,"Islamic Azad Univ, Dept Civil Engn, Tabriz Branch",Tabriz 5157944533,Iran
be4886d2-c500-4832-b2dd-c3f149b2d455,"Monash Univ, Fac Engn, Dept Civil Engn, Clayton",Vic 3800,Australia
f3e039ac-1d71-40d7-8dbc-a48c3015bde4,"Islamic Azad Univ, Dept Comp Engn, Tabriz Branch",Tabriz 5157944533,Iran
f63f25fe-9db0-49f5-bc78-1f1a0991d76c,"Univ Tabriz, Dept Educ Sci",Tabriz 5166616471,Iran
b4ea528f-11c3-4a50-b316-9da71428220c,"Prince Sattam Bin Abdulaziz Univ, Coll Engn Al Kharj, Dept Civil Engn",Al Kharj 11942,Saudi Arabia
deea40e8-f26a-43cd-80b6-b6201e5b9d58,"Canadian Int Coll CIC, Dept Civil Engn, Zayed Campus",Giza 12577,Egypt
87c0acf4-c4c4-4239-a92a-b0634194dc20,"Arab Acad Sci Technol & Maritime Transport AASTMT, Coll Engn & Technol, Mech Engn Dept, B 2401 Smart Village",Giza 12577,Egypt
b346a432-ba53-43c9-ae8f-79569bee8bcf,"Arab Acad Sci Technol & Maritime Transport AASTMT, Coll Engn & Technol, Bldg & Bldg Engn Dept, B 2401 Smart Village",Giza 12577,Egypt
3b351b9b-b734-42d7-8397-eaa80d03d3ef,"Teesside Univ, Sch Comp Engn & Digital Technol",Middlesbrough TS1 3BX,England
7357569f-b3bc-4d1f-b61c-07a51eeef18a,"Trinity Coll Dublin, Dept Civil Struct & Environm Engn",Dublin D02 PN40,Ireland
7009ee60-c570-4ae2-95f0-6c1402708733,"Natl Cent Univ, Dept Civil Engn",Taoyuan 320317,Taiwan
7e691cc1-b6fa-454c-a236-e6a345e1dbe4,"Natl Cent Univ, Res Ctr Smart Construct",Taoyuan 320317,Taiwan
511ad38a-a396-421c-ae91-f9b787eb6226,Wispro Technol Consulting Corp,Taipei 114017,Taiwan
45aa4620-5fa2-40e9-ae05-155c8bcf4dc3,"North China Univ Water Resources & Elect Power, Sch Water Conservancy",Zhengzhou 450046,Peoples R China
1ecf3b09-36eb-4368-9179-da39c2f0fb5d,Architectural Assoc Sch Architecture,London,England
9272a3b6-ea14-4778-8034-246fda8cc96c,"Aalto Univ, Sch Art Design & Architecture",Espoo,Finland
f9262d11-65f2-4e42-a3df-1271c5902fb0,Singapore Univ Technol & Design,Singapore,Singapore
0712ede7-37a4-421d-b953-3449723e04e9,"Lulea Univ Technol, Dept Civil Environm & Nat Resources Engn, Construct Management & Bldg Technol",S-97187 Lulea,Sweden
c76815cb-26e5-40f9-a0c2-0be6d29c50d0,"IQ Samhallsbyggnad, Drottninggatan 33",S-11151 Stockholm,Sweden
48e23c8c-1979-484c-b20e-d7dde51735c1,"Fed Univ Technol Akure, Dept Quant Surveying",Akure 340271,Nigeria
5a06f5db-8ff4-4823-a153-9c77503d32cb,"Arab Acad Sci Technol & Maritime Transport AASTMT, Coll Engn & Technol, Construct & Bldg Engn Dept, B 2401 Smart Village",Giza 12577,Egypt
dff96279-3901-4c4e-9dad-91bf06850f97,"Univ Teknol Malaysia UTM, Fac Engn, Sch Civil Engn, Dept Water & Environm Engn, Skudia 81310",Johor,Malaysia
f219fec3-430e-41c7-aac6-ef49823e0d9c,"Georgia Inst Technol, Sch Architecture, 245 4th St NW, Atlanta",GA,United States
04d2a7b0-3726-446c-beb7-8523917aafb5,"Georgia Inst Technol, Sch Bldg Construct, 280 Ferst Dr, Atlanta",GA,United States
1b3bbad8-c115-4cd3-987f-1d12a009e2f6,"KTH Royal Inst Technol, Sch Engn Sci Chem Biotechnol & Hlth",Stockholm,Sweden
402100d8-8106-4921-8e69-fd90427e9852,Obafemi Awolowo Univ,Ife,Nigeria
4c592081-1b85-403b-8dd8-c71d9e3ed108,"Hanoi Architectural Univ, Inst Training & Technol, Km10, Nguyen Trai Str",Hanoi,Vietnam
caed7443-4a77-439c-9847-ea4f3ac0b4c5,"Thuyloi Univ, Fac Civil Engn, 175 Tay Son Str",Hanoi,Vietnam
26747bd0-0bea-4c75-9536-44676f0e5866,"Hanoi Architectural Univ, Fac Urban Environm & Infrastruct Engn, Km10, Nguyen Trai Str",Hanoi,Vietnam
8d1f03f7-6f66-48b5-8e49-cebb1c786977,"Univ Transport Technol, Investment Management & Basic Construct Dept, 54 Trieu Khuc Str",Hanoi,Vietnam
0c1913c4-aa41-4f4a-a11e-6dde45fe77cf,"Hanoi Architectural Univ, Fac Informat Technol, Km10, Nguyen Trai Str",Hanoi,Vietnam
46fd7fda-75e6-4af4-a2f2-2557e91b51c7,"Univ Exeter, Initiat Digital Econ",Exeter,England
8c357f53-00b1-4b55-8ea2-ac291e9e4dd6,"Ara Inst Canterbury, Dept Engn & Architectural Studies",Christchurch 8011,New Zealand
59c2853b-6075-427c-9f9d-28d5b40ad176,"Univ Sains Malaysia, Sch Housing Bldg & Planning, Gelugor 11800",Penang,Malaysia
ecb3f0b5-1deb-4a3f-ad01-99f6b69b7df2,"Univ Hong Kong, Dept Real Estate & Construct, Pokfulam",Hong Kong,Peoples R China
7d109744-ebb8-4703-8f11-1ea2349fa93c,"Beijing Univ Civil Engn & Architecture, Sch Urban Econ & Management",Beijing 102616,Peoples R China
a182b864-5c3a-4503-acf4-1bcc75fb2a59,"Harbin Inst Technol, Sch Civil Engn",Harbin 150001,Peoples R China
eb5e3f00-b720-4768-82bf-2451f69fe7f5,"RMIT Univ, Sch Property Construct & Project Management, Melbourne",Vic,Australia
b6bae568-32e9-42c5-901d-67b07473c7cb,"Curtin Univ, Sch Design & Built Environm, Perth",WA,Australia
de2814ab-e819-4e43-80ad-85f8c75298e0,"Sustainable Built Environm Natl Res Ctr, Perth",WA,Australia
c72649b7-7e80-4d76-9f12-01cf509b894c,"RMIT Univ, Sch Property Construct & Project Management, 124 Trobe St, Melbourne",Vic 3000,Australia
c2f1fb99-9e9a-465e-8ed1-8376f8102193,"Yildiz Tech Univ, Dept Civil Engn",Istanbul,Turkey
70639cf7-0657-43df-916b-e90d6e608f04,"Sejong Univ, Dept Architectural Engn",Seoul 05006,South Korea
a1a68884-6c45-4847-b0f3-526a7b624cb4,"Sejong Univ, Deep Learning Architecture Res Ctr, Dept Architectural Engn",Seoul 05006,South Korea
e99fff0d-953e-48a4-af0f-83549b308a06,"Yonsei Univ, Dept Architecture & Architec tural Engn",Seoul 03722,South Korea
c073a944-5994-4d30-8a7f-6dd4c5666df0,"Nanyang Technol Univ, Sch Mech & Aerosp Engn, 50 Nanyang Ave",Singapore 639798,Singapore
3a61f389-b4c6-4b1e-9cd1-ce69c9b10b18,"Nanyang Technol Univ, Surbana Jurong NTU Corp Lab, 61 Nanyang Dr",Singapore 637335,Singapore
290dcad3-2186-49cf-a97a-0e96515d47de,"Western Sydney Univ, Sch Engn Design & Built Environm, Penrith",NSW 2751,Australia
bc69ef83-0150-4be4-a024-c68d4d46e696,"Univ New South Wales, Sch Built Environm, Sydney",NSW,Australia
d69d9593-6e3a-487b-a958-5709c1815a77,"Hanoi Univ Civil Engn, Fac Construct Econ & Management, 55 Giai Phong Rd",Hanoi,Vietnam
1a83c278-5874-4ca2-9625-b6a719021deb,"Hanoi Architectural Univ, Fac Informat Technol, Km10, Nguyen Trai St",Hanoi,Vietnam
98a889f1-e265-4c86-b531-a935986a1b02,"George Washington Univ, Dept Civil & Environm Engn, Washington",DC,United States
41b931a3-304b-480e-bc95-0c3d1ca2c70c,"Univ Tehran, Sch Civil Engn, Dept Engn",Tehran 1417935840,Iran
16c75968-de97-4875-90c9-3fc0156843c6,"Virginia Tech, Bradley Dept Elect & Comp Engn, Blacksburg",VA,United States
44486a9a-cfdc-41d4-8bfb-7e2a154454dc,"Univ Malaysia Pahang, Fac Civil Engn Technol",Gambang 26300,Malaysia
bed7eb04-7247-4e77-a1b0-79153bdb505f,"Daffodil Int Univ, Gen Educ Dev",Dhaka 1341,Bangladesh
30e0a14a-bd4c-42c3-a7f0-ef917962faf6,"Tianjin Univ, Coll Management & Econ",Tianjin 300072,Peoples R China
26f5a9e8-6a99-43c8-a6bb-d287d2d088b7,China Petr Planning & Engn Inst,Beijing 100083,Peoples R China
1a174b51-7cb1-4c85-98bf-8118008fca22,"Univ Colorado, Dept Civil Environm & Architectural Engn, 1111 Engn Dr, UCB 428, Boulder",CO,United States
510b58fa-f0af-4c21-9a7d-cecc9e0447a7,"Construct Ind Inst, Funded Studies, 3925 West Braker Ln R4500, Austin",TX,United States
fbf0c0f6-87e6-4dfd-b79c-bc3909acd318,"Univ Texas Austin, Dept Civil Architectural & Environm Engn, Civil Engn Construct Engn & Project Management, 301 E Dean Keeton St C1752, Austin",TX,United States
dd349b0a-2bb9-45fe-b045-fd36e352bb9d,"Univ Sharjah, Coll Engn, Dept Architectural Engn, POB 27272",Sharjah,United Arab Emirates
80130f6c-f73e-43b8-84bc-b92c86614ef4,"Xian Univ Sci & Technol, Coll Architecture & Civil Engn",Xian 710054,Peoples R China
bea06de7-adbd-49c1-a36d-419341349d50,"Cent South Univ, Sch Civil Engn",Changsha 410075,Peoples R China
94b3173b-7cc0-4154-bba4-af0f5414dc27,"Obafemi Awolowo Univ, Dept Bldg",Ife,Nigeria
93928264-72b9-471f-8490-f30b6691e0cf,"Monash Univ, Fac Engn, Dept Civil Engn, Melbourne",Vic 3800,Australia
5a529ee2-92be-4ffc-80ad-69c57d77675d,"Linkoping Univ, Business & Adm",S-58183 Linkoping,Sweden
0cc1a3aa-ef76-4eaf-9546-5fb8bc6a8019,"Linkoping Univ, Themat Studies Technol & Social Change",S-58183 Linkoping,Sweden
d1f03b3f-40a3-4155-a9ea-e0e7d6e404a6,"Curtin Univ, Sch Design & Built Environm, Bentley",WA 6102,Australia
d8d0a555-8546-44ff-be1b-31ebe7815920,"Najran Univ, Dept Civil Engn",Najran,Saudi Arabia
eab6d014-9447-4f3b-a380-7d75177930eb,"Amer Univ Middle East, Coll Engn & Technol",Kuwait,Kuwait
ab1e2281-d3d0-4554-ad7c-7d391b6e5172,"Jouf Univ, Dept Civil Engn",Al Jauf,Saudi Arabia
1f155a75-77e0-425c-8a11-0daf8b036c0a,"COMSATS Univ Islamabad, Dept Civil Engn, Abbottabad Campus",Abbottabad 22060,Pakistan
5ab92099-7565-4ac5-bb1a-76ce52f9ab47,"King Khalid Univ, Dept Civil Engn",Abha 61421,Saudi Arabia
2aaa857a-2e2f-477b-abe4-354e9bae0c8c,"Univ Engn & Technol Peshawar, Dept Architecture, Abbottabad Campus",Peshawar,Pakistan
385f14e4-bb43-453f-a069-08c522c6d545,"Cardiff Univ, Sch Engn, Parade, Queens Bldg",Cardiff CF24 3AA,England
c21c6a22-e3d8-4c81-81d6-1ce904af66c7,"Newcastle Univ, Sch Comp",Newcastle Upon Tyne NE1 7RU,England
4961e2de-f86b-4073-a117-88acaab623ca,"Hanyang Univ, Dept Architectural Engn",Seoul 04763,South Korea
91dbd3fe-a3e1-4602-942a-a29b0dd2914b,"Hanyang Cyber Univ, Dept Digital Architecture & Urban Engn",Seoul 04763,South Korea
e53dbc74-1cc6-4232-b995-88b9269636e4,"Zhengzhou Univ, Sch Management",Zhengzhou 450001,Peoples R China
b23e456b-179c-4d73-958a-4072f15338a9,"Henan Finance Univ, Sch Engn Econ",Zhengzhou 450046,Peoples R China
b2c3b91e-602d-43ef-8609-92919a00c4a5,"Guangzhou Univ, Sch Management",Guangzhou 510006,Peoples R China
a4723d07-7739-408c-b223-bded5931928e,Dongguan Inst Bldg Res,Dongguan 523000,Peoples R China
57d7c54f-cb81-42b7-a812-247e8d02c462,"Univ Moratuwa, Dept Bldg Econ",Moratuwa,Sri Lanka
84587a63-cbe5-4d9f-a2b8-b17c1f7f5ee7,"Northumbria Univ, Fac Engn & Environm",Newcastle Upon Tyne,England
898eefb3-ebfa-4534-993f-c2582756aa4f,"Univ Tehran, Sch Architecture, Dept Project & Construct Management",Tehran 1415564583,Iran
e3bf0a9e-7818-4381-ada0-3b36d67788a2,"Konya Tech Univ, Fac Engn & Nat Sci, Dept Geomat Engn",TR-42250 Konya,Turkey
3199d028-c149-4691-a614-b5be140abb05,"Univ Malaya, Ctr Bldg Construct & Trop Architecture BuCTA",Kuala Lumpur,Malaysia
260e184c-4e35-4705-b2bb-520b6e355e9c,"Univ Teknol MARA, Coll Built Environm, Sch Construct & Quant Surveying",Shah Alam,Malaysia
edd06c97-1cad-41ee-9676-cd51244c365a,"Univ Malaya, Fac Built Environm, Dept Quant Surveying",Kuala Lumpur,Malaysia
8cc05225-adb2-4af8-bb9a-4700efe66b86,"Univ Naples Federico II, Dept Civil Construct & Environm Engn",I-80125 Naples,Italy
4792266f-cc13-4353-8aab-15aeda5049b0,"Pontifical Catholic Univ Rio de Janeiro PUC, Rio De Janeiro",RJ,Brazil
4820c144-4649-4469-9320-44e499e8141a,"Univ Sains Malaysia, Sch Housing Bldg & Planning",George Town 11800,Malaysia
0b86e9f6-8df0-4b45-a9a4-013cc790ab9e,"Univ Malaysia Pahang, Fac Civil Engn Technol",Kuantan 26300,Malaysia
1cb6cdc1-e09c-4d29-ba72-b053e8dba1d0,"Yonsei Univ, Dept Architecture & Architectural Engn, Bldg Informat Grp",Seoul,South Korea
d032e47c-de62-43fb-8411-bcbb9b99e5d3,"Sungkyunkwan Univ, Dept Convergence Engn Future City",Suwon 16419,South Korea
8244777b-53f7-4162-8237-f5a84b79de10,"Sungkyunkwan Univ, Sch Civil Architectural Engn & Landscape Architect",Suwon 16419,South Korea
1502781f-74f4-45b0-953e-b92c8cc6d90c,"Kyungpook Natl Univ, Sch Architecture",Daegu 41566,South Korea
284ff69d-ca92-4658-80a8-c2dcbb1d79d3,"Southeast Univ, China Pakistan Belt & Rd Joint Lab Smart Disaster",Nanjing 210096,Peoples R China
e90dff83-9e00-4bf3-aa38-41f0b1f001dc,"Univ Lisbon, Higher Tech Inst, Dept Civil Engn",P-1649004 Lisbon,Portugal
d173cfb2-3af5-414d-b679-78c872308082,CERIS Civil Engn Res & Innovat Sustainabil,Lisbon,Portugal
bf30540d-7211-4486-9330-084a77a117b1,"Arab Acad Sci Technol & Maritime Transport AASTMT, Coll Engn & Technol, Construct & Bldg Engn Dept, B2401 Smart Village",Giza 12577,Egypt
ed2d3202-102f-4217-9946-374c30b33938,"Loughborough Univ, Sch Architecture Bldg & Civil Engn",Loughborough LE11 3TU,England
caf20e79-dde1-40f6-952a-e3c4de41a46b,"Arab Acad Sci Technol & Maritime Transport AASTMT, Coll Engn & Technol, Construct & Bldg Engn Dept",Alexandria 1029,Egypt
08d5ff48-b37d-4c74-8c7e-f0eab65abab1,"Univ British Columbia, Dept Civil Engn, Project & Construct Management Grp, Vancouver",BC V6J 1E5,Canada
2c5f5453-8e67-403e-9206-e88ad7c3e1f0,"Beijing Univ Civil Engn & Architecture, Beijing Key Lab Intelligent Proc Bldg Big Data",Beijing 100044,Peoples R China
c03b3808-3fa1-45a7-9f2d-a5afb963e3af,"Anhui Jianzhu Univ, Anhui Prov Key Lab Intelligent Bldg & Bldg Energy",Hefei 230022,Peoples R China
bb01598c-0d5a-457e-8d40-51eabb9eb758,Capital Engn & Res Inc Ltd,Beijing 100176,Peoples R China
15aa1b8b-ce25-422c-a840-cb83703d5aff,"Renmin Univ China, Sch Informat",Beijing 100096,Peoples R China
76d2aab2-3a25-46c3-a4cb-8b266458b780,"Southeast Univ, Sch Architecture, 90 Chengxian St",Nanjing 210096,Peoples R China
a5e2e0b1-fb0d-4e1f-8fda-373f0aaaaf9a,"Kwangwoon Univ, Dept Architectural Engn",Seoul 01897,South Korea
27ac2ba1-f760-41d8-a5d5-dafc23533cb0,"Zhejiang Univ, Canc Inst, Key Lab Canc Prevent & Intervent, China Natl Minist Educ, Affiliated Hosp 2, Sch Med",Hangzhou 310009,Peoples R China
2b1b902e-43fb-4d4e-a69a-1479afe37f84,"Chaoyang Univ Technol, Dept Civil & Construct Engn, 168 Jifeng E Rd",Taichung,Taiwan
930cac67-9125-48c3-84cf-aa0f657065cd,"Chalmers Univ Technol, Dept Architecture & Civil Engn",Gothenburg,Sweden
7be950d6-640e-448f-88f0-e74bf03b5b5b,Byggstyrning Malardalen AB,Stockholm,Sweden
75807a9b-f287-409d-9507-439aefce782b,"Univ Canterbury, Dept Civil & Nat Resources Engn, Christchurch",Canterbury,New Zealand
73fb2593-86fb-45da-99a0-6c3629e0ecc2,"Univ Teknol Malaysia, Fac Built Environm & Surveying, Dept Quant Surveying",Johor Baharu 81310,Malaysia
563ea4cd-6280-41b5-82f6-315782cf638a,"Univ Birmingham, Birmingham B15 2TT",W Midlands,England
d71970a8-21c7-4a74-a638-86b5707e9777,"Islamic Azad Univ, Sci & Res Branch, Dept Civil Engn Architecture & Art",Tehran,Iran
3e23c288-f481-467b-ab49-dba7e4673492,"KN Toosi Univ Technol, Civil Engn Dept",Tehran,Iran
0ce82feb-3db2-430e-a027-84ff6756f089,"Univ Canberra UC, Fac Arts & Design, Sch Design & Built Environm, Canberra",ACT,Australia
cd96ad10-e02a-4e07-832f-92fb67811fea,"Swiss Fed Inst Technol, Inst Construct & Infrastruct Management, Chair Sustainable Construct, Stefano Franscini Pl 5",CH-8093 Zurich,Switzerland
ba58850b-1c04-4061-86d8-11419bf57b93,"Chalmers Univ Technol, Dept Architecture & Civil Engn",S-41296 Gothenburg,Sweden
a66ef174-89f9-46a6-a729-630b63014f2c,Integrated Digital Planning Team,Basler and Hoffman,Switzerland
c4487184-f1b2-4128-8816-a9fcbee6a7ed,"UCL, Bartlett Sch Construct Project Management",London WC1E 6BT,England
31477cd4-70df-40e1-8e2d-bda5b6864bbc,"Univ Bath, Sch Management, Bath BA2 7BA",Avon,England
8b8f317b-8005-494a-acfb-c8f74306bea0,"Xian Jiaotong Liverpool Univ, Dept Civil Engn, 111 Renai Rd, Suzhou Ind Pk",Suzhou 215123,Peoples R China
c934d08a-8c23-44a7-ac27-692cafdfc9d5,"Univ Liverpool, Dept Civil Engn & Ind Design, Liverpool L69 3BX",Merseyside,England
ebf2b583-8cd3-4757-874b-a46ff46a4ceb,"Saiwill Educ & Technol, 6 Huixinnanli Rd",Beijing 10000,Peoples R China
5e44ecb9-8509-427c-a9ca-7926a58478f4,"Virginia Tech, Dept Ind & Syst Engn, Blacksburg",VA,United States
7bee68a7-8d6c-41fc-833f-6da280840b39,"Univ Malaysia Pahang, Fac Ind Management",Gambang 26300,Malaysia
b5ba8d9d-16df-4f76-b3f7-66d7a8501b82,"Amirkabir Univ Technol, Dept Civil & Environm Engn, Tehran",1591634311,Iran
014c8f26-02c3-477b-bdad-3edabbbdd72a,"Visvesvaraya Natl Inst Technol, Dept Civil Engn, Nagpur 440010",Maharashtra,India
